id,rated,created_at,last_move_at,turns,victory_status,winner,increment_code,white_id,white_rating,black_id,black_rating,moves,opening_eco,opening_name,opening_ply
TZJHLljE,False,1504210000000.0,1504210000000.0,13,outoftime,white,15+2,bourgris,1500,a-00,1191,d4 d5 c4 c6 cxd5 e6 dxe6 fxe6 Nf3 Bb4+ Nc3 Ba5 Bf4,D10,Slav Defense: Exchange Variation,5
l1NXvwaE,True,1504130000000.0,1504130000000.0,16,resign,black,5+10,a-00,1322,skinnerua,1261,d4 Nc6 e4 e5 f4 f6 dxe5 fxe5 fxe5 Nxe5 Qd4 Nc6 Qe5+ Nxe5 c4 Bb4+,B00,Nimzowitsch Defense: Kennedy Variation,4
mIICvQHh,True,1504130000000.0,1504130000000.0,61,mate,white,5+10,ischia,1496,a-00,1500,e4 e5 d3 d6 Be3 c6 Be2 b5 Nd2 a5 a4 c5 axb5 Nc6 bxc6 Ra6 Nc4 a4 c3 a3 Nxa3 Rxa3 Rxa3 c4 dxc4 d5 cxd5 Qxd5 exd5 Be6 Ra8+ Ke7 Bc5+ Kf6 Bxf8 Kg6 Bxg7 Kxg7 dxe6 Kh6 exf7 Nf6 Rxh8 Nh5 Bxh5 Kg5 Rxh7 Kf5 Qf3+ Ke6 Bg4+ Kd6 Rh6+ Kc5 Qe3+ Kb5 c4+ Kb4 Qc3+ Ka4 Bd1#,C20,King's Pawn Game: Leonardis Variation,3
kWKvrqYL,True,1504110000000.0,1504110000000.0,61,mate,white,20+0,daniamurashov,1439,adivanov2009,1454,d4 d5 Nf3 Bf5 Nc3 Nf6 Bf4 Ng4 e3 Nc6 Be2 Qd7 O-O O-O-O Nb5 Nb4 Rc1 Nxa2 Ra1 Nb4 Nxa7+ Kb8 Nb5 Bxc2 Bxc7+ Kc8 Qd2 Qc6 Na7+ Kd7 Nxc6 bxc6 Bxd8 Kxd8 Qxb4 e5 Qb8+ Ke7 dxe5 Be4 Ra7+ Ke6 Qe8+ Kf5 Qxf7+ Nf6 Nh4+ Kg5 g3 Ng4 Qf4+ Kh5 Qxg4+ Kh6 Qf4+ g5 Qf6+ Bg6 Nxg6 Bg7 Qxg7#,D02,Queen's Pawn Game: Zukertort Variation,3
9tXo1AUZ,True,1504030000000.0,1504030000000.0,95,mate,white,30+3,nik221107,1523,adivanov2009,1469,e4 e5 Nf3 d6 d4 Nc6 d5 Nb4 a3 Na6 Nc3 Be7 b4 Nf6 Bg5 O-O b5 Nc5 Bxf6 Bxf6 Bd3 Qd7 O-O Nxd3 Qxd3 c6 a4 cxd5 Nxd5 Qe6 Nc7 Qg4 Nxa8 Bd7 Nc7 Rc8 Nd5 Qg6 Nxf6+ Qxf6 Rfd1 Re8 Qxd6 Bg4 Qxf6 gxf6 Rd3 Bxf3 Rxf3 Rd8 Rxf6 Kg7 Rf3 Rd2 Rg3+ Kf8 c3 Re2 f3 Rc2 Rg5 f6 Rh5 Kg7 Rd1 Kg6 Rh3 Rxc3 Rd7 Rc1+ Kf2 Rc2+ Kg3 h5 Rxb7 Kg5 Rxa7 h4+ Rxh4 Rxg2+ Kxg2 Kxh4 b6 Kg5 b7 f5 exf5 Kxf5 b8=Q e4 Rf7+ Kg5 Qg8+ Kh6 Rh7#,C41,Philidor Defense,5
MsoDV9wj,False,1504240000000.0,1504240000000.0,5,draw,draw,10+0,trelynn17,1250,franklin14532,1002,e4 c5 Nf3 Qa5 a3,B27,Sicilian Defense: Mongoose Variation,4
qwU9rasv,True,1504230000000.0,1504230000000.0,33,resign,white,10+0,capa_jr,1520,daniel_likes_chess,1423,d4 d5 e4 dxe4 Nc3 Nf6 f3 exf3 Nxf3 Nc6 Bb5 a6 Bd3 Bg4 O-O Nxd4 Be2 Nxe2+ Qxe2 Bxf3 Qxf3 Qd4+ Be3 Qg4 Qxb7 Rd8 Qc6+ Nd7 Nd5 e6 Nxc7+ Ke7 Bd2,D00,Blackmar-Diemer Gambit: Pietrowsky Defense,10
RVN0N3VK,False,1503680000000.0,1503680000000.0,9,resign,black,15+30,daniel_likes_chess,1413,soultego,2108,e4 Nc6 d4 e5 d5 Nce7 c3 Ng6 b4,B00,Nimzowitsch Defense: Kennedy Variation |  Linksspringer Variation,5
dwF3DJHO,True,1503510000000.0,1503510000000.0,66,resign,black,15+0,ehabfanri,1439,daniel_likes_chess,1392,e4 e5 Bc4 Nc6 Nf3 Nd4 d3 Nxf3+ Qxf3 Nf6 h3 Bc5 a3 O-O Be3 Bxe3 Qxe3 Re8 Qf3 c6 Nc3 b5 Bb3 Qa5 O-O Bb7 Ne2 c5 Rfd1 d6 c4 bxc4 dxc4 Rac8 Rd5 Bxd5 exd5 Qb6 Nc1 e4 Qf4 Nh5 Qg4 Nf6 Qf4 Qa5 Bc2 Qe1+ Kh2 Nh5 Qxd6 Qxf2 Bxe4 Rxe4 Nd3 Qg3+ Kg1 Qxd3 Rf1 Rce8 Qd7 Qe3+ Kh1 Ng3+ Kh2 Nxf1+,C50,Italian Game: Schilling-Kostic Gambit,6
afoMwnLg,True,1503440000000.0,1503440000000.0,119,mate,white,10+0,daniel_likes_chess,1381,mirco25,1209,e4 d5 exd5 Qxd5 Nc3 Qe5+ Be2 Na6 d4 Qf5 Bxa6 bxa6 Nf3 Qe6+ Be3 Bb7 Ng5 Qc4 Qh5 Bxg2 Qxf7+ Qxf7 Nxf7 Kxf7 Rg1 Bf3 Rg3 Bh5 Rh3 g6 Ne4 Nf6 Nc5 e6 Nxa6 Rc8 Bf4 Bg4 Rg3 c6 Nb4 Bxb4+ c3 Ba5 b4 Bc7 Bxc7 Rxc7 Rb1 e5 dxe5 Re8 f4 Rd7 Kf2 Rd2+ Kg1 Rxa2 exf6 Kxf6 Rxg4 Kf5 Rg2 Rxg2+ Kxg2 Re2+ Kf3 Re4 Ra1 Rxf4+ Kg3 Rg4+ Kh3 h5 Rxa7 g5 Rf7+ Kg6 Rf3 Rf4 Rxf4 gxf4 Kg2 Kg5 c4 h4 b5 cxb5 cxb5 Kg4 b6 f3+ Kf2 Kf4 b7 h3 b8=Q+ Ke4 Qb4+ Kd5 Kxf3 Ke5 Kg3 Kf6 Qe4 Kg5 Qf3 Kh6 Qg4 Kh7 Qg5 Kh8 Kf4 Kh7 Kf5 Kh8 Kf6 Kh7 Qg7#,B01,Scandinavian Defense: Mieses-Kotroc Variation,4
HgKLWPsz,False,1503350000000.0,1503350000000.0,39,mate,white,20+60,daniel_likes_chess,1381,anaissac,1272,e3 e6 d4 d6 Bd3 c6 Nf3 Be7 Nc3 Nf6 Bd2 Bd7 Qe2 c5 dxc5 dxc5 O-O b6 Rfe1 Bc6 e4 O-O e5 Nd5 Nxd5 Qxd5 Bc4 Qd7 Rad1 Qb7 Bg5 Re8 Bxe7 Rxe7 Rd8+ Re8 Red1 Bd5 Rxe8#,A00,Van't Kruijs Opening,1
Vf5fKWzI,False,1503350000000.0,1503350000000.0,38,resign,black,20+60,daniel_likes_chess,1381,subham777,1867,e4 e6 d4 d5 e5 c5 c3 Nc6 Nf3 Qb6 Be3 Qxb2 Nbd2 cxd4 cxd4 Nb4 Rb1 Qxa2 Qb3 Qxb3 Nxb3 Nc2+ Kd1 Nxe3+ fxe3 Ne7 Nc5 Nf5 e4 dxe4 Nxe4 Ne3+ Ke2 Nxf1 Rhxf1 b6 Ned2 Ba6+,C02,French Defense: Advance Variation |  Paulsen Attack,9
HRti5mKv,False,1503350000000.0,1503350000000.0,60,resign,black,5+40,daniel_likes_chess,1381,roman12342005,1936,e4 e6 Nf3 d5 exd5 exd5 Qe2+ Be7 Nc3 Nf6 d4 O-O g4 Bxg4 Bg2 Nbd7 O-O c6 h3 Bh5 Bf4 Re8 Rfe1 Bd6 Be3 Nb6 Ng5 h6 Nf3 Nc4 b3 Nxe3 fxe3 Bf4 Nd1 Nd7 Qd2 Bd6 c4 dxc4 bxc4 a5 a4 Bb4 Nc3 Qc7 Rad1 Bxc3 Qxc3 Qg3 e4 Re6 d5 Rf6 Re3 Nc5 Ra1 Rg6 Ra2 Nxe4,C00,French Defense: Knight Variation,3
2fEjSei6,False,1503340000000.0,1503340000000.0,31,resign,black,8+0,daniel_likes_chess,1381,alkhan,1607,e4 e6 Qh5 g6 Qe5 Nf6 d4 d6 Qb5+ Bd7 Qxb7 Bc6 Qb3 Nxe4 Qe3 Nd7 f3 Nef6 Bd3 Bg7 Qf2 Nh5 g4 Nf4 Qg3 Nxd3+ cxd3 Bxd4 Nc3 Nc5 Be3,C00,French Defense #2,2
u7i6dOaJ,False,1504090000000.0,1504100000000.0,31,mate,white,15+15,shivangithegenius,1094,sureka_akshat,1141,e4 e5 Nf3 Nc6 Bc4 Nf6 Nc3 Bc5 O-O O-O d3 Ne8 Bg5 Nf6 Nd5 h6 Nxf6+ gxf6 Bxh6 Re8 Ne1 d6 Qh5 Re7 Nf3 Be6 Bxe6 Rxe6 Qg4+ Kh8 Qg7#,C50,Four Knights Game: Italian Variation,8
guanvMR5,False,1504090000000.0,1504090000000.0,43,resign,black,15+15,sureka_akshat,1141,shivangithegenius,1094,e4 e5 Nf3 Nc6 Bc4 Nf6 Ng5 Qe7 O-O Nxe4 Nxe4 h6 Re1 Qh4 g3 Qd8 Nec3 Bc5 Kh1 O-O f4 d6 fxe5 dxe5 Rf1 Qd7 Nd5 b6 Qh5 Nd8 g4 Bb7 g5 Bxd5+ Bxd5 Qxd5+ Rf3 hxg5 Qxg5 Qxf3+ Qg2 Qd1+ Qf1,C57,Italian Game: Two Knights Defense |  Knight Attack,7
PmpkWkmm,False,1504090000000.0,1504090000000.0,52,resign,black,15+15,shivangithegenius,1094,sureka_akshat,1141,e4 e5 Nf3 Nc6 Bc4 Nf6 Nc3 Bc5 O-O O-O Ne1 d6 d3 Ne8 Qf3 Nd4 Qg3 Bb4 Bh6 g6 Bxf8 Bxc3 Qe3 Kxf8 bxc3 Nc6 Qf3 Nf6 Rd1 Bg4 Qg3 Bxd1 h3 Be2 Nf3 Nh5 Qg4 Bxf1 Kxf1 Nf6 Ng5 Nxg4 Nxf7 Nh2+ Kg1 Qh4 Kxh2 Qxf2 Be6 Nd8 Nxd8 Rxd8,C50,Four Knights Game: Italian Variation,8
EwaK0IsE,False,1504010000000.0,1504010000000.0,66,mate,black,15+16,sureka_akshat,1141,shivangithegenius,1094,e4 e5 Nf3 Nc6 Bc4 Nf6 Nc3 Bc5 O-O O-O Ne1 Ne8 Qf3 Qg5 d4 Qg6 dxc5 Nd4 Qd1 d6 g3 Bh3 Nf3 Bxf1 Qxf1 Nxf3+ Kg2 Nh4+ Kh1 Nf3 Nd5 Qe6 Nxc7 Qc8 Nxa8 Qxa8 cxd6 Nxd6 Be2 Nd4 Bd3 Qc8 c3 Ne6 Qe1 Nc4 Bxc4 Qxc4 b3 Qc6 Ba3 Rd8 Be7 Rd7 Ba3 Ng5 Qd2 Rxd2 Kg2 Qxe4+ Kf1 Qe2+ Kg2 Qxf2+ Kh1 Qxh2#,C50,Four Knights Game: Italian Variation,8
yrSDozT3,False,1504010000000.0,1504010000000.0,101,resign,black,15+15,shivangithegenius,1094,slam_ment,1300,e4 e5 Nf3 d6 Bc4 Be6 d3 Bxc4 dxc4 c5 O-O h6 Nc3 Nf6 Nd5 Nxe4 Re1 Nf6 Nxf6+ Qxf6 Qd5 Nd7 Qxb7 Rb8 Qxa7 Be7 Bd2 Qf5 c3 Qc2 Rab1 O-O Rec1 Qd3 b4 Rfd8 bxc5 dxc5 Rxb8 Rxb8 Rd1 Rb1 Qa8+ Bf8 Qa4 Rxd1+ Qxd1 e4 Ne1 Qd6 h3 Qe5 a4 Bd6 f4 Qf5 Be3 Bxf4 Bxf4 Qxf4 Qxd7 Qe3+ Kh2 Qxe1 Qe8+ Kh7 Qxf7 e3 Qf5+ Kg8 Qd5+ Kh7 Qxc5 e2 Qf5+ Kg8 Qe6+ Kh7 Qe4+ Kg8 a5 Qd1 Qa8+ Kh7 Qe4+ Kg8 Qd5+ Qxd5 cxd5 e1=Q a6 Qa1 d6 Qxa6 d7 Qa8 c4 Qd8 c5 Qxd7 c6,C41,Philidor Defense #3,5
x31mXlvc,False,1503760000000.0,1503760000000.0,25,resign,white,11+0,g-ios,1500,shivangithegenius,1094,d4 d5 h3 Nc6 Nf3 Nf6 Bg5 h6 Bxf6 exf6 e3 Bb4+ c3 Bd6 Bb5 Bd7 O-O a6 Ba4 b5 Bb3 Na5 Bxd5 Nc4 Bxa8,D00,Queen's Pawn Game,2
oQklnWWp,False,1502950000000.0,1502950000000.0,14,resign,black,15+15,shivangithegenius,1094,lex_v1,1676,e4 e5 Nf3 Nc6 Bc4 h6 O-O Bc5 d3 Nf6 Nc3 Ng4 h3 Nxf2,C55,Italian Game: Anti-Fried Liver Defense,6
QFCZwY1f,False,1502950000000.0,1502950000000.0,3,resign,white,30+60,shivangithegenius,1094,themannichreaction,1068,d4 e6 Nc3,A40,Horwitz Defense,2
5cgBygpI,False,1502950000000.0,1502950000000.0,17,resign,white,15+5,storm28rus,1500,shivangithegenius,1094,e4 c5 Bc4 Nf6 Nc3 d6 Nf3 g6 Ng5 e6 d3 Bg7 O-O Bh6 Nxe6 fxe6 Bxh6,B20,Sicilian Defense: Bowdler Attack,3
UhXXBOMY,True,1502950000000.0,1502950000000.0,36,resign,white,10+0,robotsmoke,1307,shivangithegenius,1106,c4 Nc6 Nc3 e5 g3 Bc5 Bg2 Nge7 e3 b6 a3 Bb7 b4 Bd6 Nb5 O-O Nxd6 cxd6 Ne2 Nf5 Nc3 d5 Nxd5 Nce7 Nxe7+ Qxe7 Bxb7 Qe8 O-O Rb8 Bg2 Rc8 d3 e4 Bxe4 Nxe3,A25,English Opening: King's English Variation |  Reversed Closed Sicilian,4
mCij4hBq,True,1502860000000.0,1502860000000.0,13,resign,black,10+0,shivangithegenius,1113,ivangonzalez123,1423,e4 c5 d4 cxd4 Qxd4 Nc6 Qa4 e5 Be3 Nf6 Nf3 h6 Nc3,B21,Sicilian Defense: Smith-Morra Gambit #2,3
ifUMWtVj,True,1502780000000.0,1502780000000.0,69,mate,white,10+10,shivangithegenius,1078,sureka_akshat,1219,d4 d5 Nc3 Nf6 Bf4 Bf5 Nf3 e6 e3 Be7 Bb5+ c6 Bd3 Bxd3 Qxd3 O-O Bg5 Ng4 Bxe7 Qxe7 O-O Qg5 h3 Qf6 hxg4 Qh6 Na4 b5 Nc5 Kh8 Nb7 g6 Nd6 Na6 Ne5 Kg8 Ndxf7 Rxf7 Nxf7 Kxf7 f4 g5 fxg5+ Kg7 gxh6+ Kxh6 Rf6+ Kg7 g5 h6 Qg6+ Kh8 Qxh6+ Kg8 Rxe6 Kf7 Qf6+ Kg8 Re8+ Rxe8 Qg6+ Kf8 Qh6+ Kg8 g6 Nb4 Rf1 Nxc2 Qh7#,D01,Queen's Pawn Game: Chigorin Variation,4
Wf0zuLQQ,True,1502780000000.0,1502780000000.0,43,resign,white,10+10,gmcarlsen403,1825,shivangithegenius,1079,e4 e5 Nf3 Nc6 d4 exd4 Bc4 Bc5 c3 dxc3 Bxf7+ Kxf7 Qd5+ Ke8 Qxc5 Qe7 Qxe7+ Ncxe7 Nxc3 d6 O-O Bg4 Nd4 Nf6 f3 Bh5 Bg5 h6 Bxf6 gxf6 Ne6 Bf7 Nxc7+ Kd7 Nxa8 Rxa8 Rfd1 Bc4 b3 Ba6 Nd5 Nxd5 Rxd5,C45,Scotch Game: Haxo Gambit,8
srz9QfSN,True,1502780000000.0,1502780000000.0,54,mate,black,10+10,mannat1,1328,shivangithegenius,1038,d4 d5 Nc3 Nf6 Nf3 Nc6 e3 Bf5 h4 e6 g3 Bb4 a3 Bxc3+ bxc3 Ne4 Rh2 Nxc3 Qd2 Ne4 Qe2 Nc3 Qd2 Ne4 Qd3 Ng5 Qb5 Nxf3+ Kd1 Nxh2 Bd3 Bg4+ Kd2 Nf3+ Kc3 a6 Qxb7 Qb8 Qxc6+ Kd8 Bxa6 e5 Bb5 exd4+ Kb3 dxe3 Qd7+ Bxd7 Kb4 Qxb5+ Kc3 Qc4+ Kb2 Rb8#,D01,Queen's Pawn Game: Chigorin Variation,4
NS6ccssb,True,1502780000000.0,1502780000000.0,53,resign,black,10+10,shivangithegenius,1056,biyanivedant01,1156,d4 d5 c4 c6 e3 dxc4 Bxc4 Nf6 Nc3 e6 e4 e5 d5 cxd5 exd5 Bd6 Bg5 O-O Bxf6 Qxf6 Nf3 Bc5 O-O Qg6 Nxe5 Qg5 Nf3 Qh6 Nb5 Na6 d6 Rd8 Qd5 Bxd6 Qxf7+ Kh8 Nxd6 Qxd6 Rfd1 Qf8 Rxd8 Qxd8 h3 Bf5 Qxf5 Qf8 Qd5 Nc7 Qxb7 Qb8 Qd5 Nxd5 Bxd5,D10,Slav Defense,4
M3vpf2Ki,True,1502780000000.0,1502780000000.0,66,mate,black,10+10,shivangithegenius,1077,chinmaysharma,1148,d4 d5 c4 Nf6 Nc3 Nc6 Nf3 e6 e3 Bd6 Bd3 Ne4 Bxe4 dxe4 Ne5 f5 Nxc6 bxc6 Qh5+ g6 Qd1 O-O O-O Bb4 a3 Bxc3 bxc3 Qe7 h3 c5 d5 exd5 cxd5 Ba6 a4 Bxf1 Qxf1 a5 Ba3 Qe5 Qd1 f4 exf4 Qxf4 Bxc5 Rf7 d6 cxd6 Bb6 Rb8 Ba7 Rxa7 Qd5+ Kg7 Qd4+ Kf8 Qxa7 Re8 Qxa5 e3 Rf1 exf2+ Rxf2 Re1+ Rf1 Rxf1#,D06,Queen's Gambit Refused: Marshall Defense,4
fXhNOnOn,True,1502780000000.0,1502780000000.0,64,resign,black,10+10,biyanivedant01,1358,shivangithegenius,1036,e4 c5 d4 cxd4 Qxd4 Nc6 Qa4 Nf6 Nc3 g6 Nf3 Bg7 Bb5 O-O O-O a6 Bg5 axb5 Qxa8 d5 Rab1 dxe4 Rbd1 Qa5 Qxa5 Nxa5 Nxb5 exf3 gxf3 Nc4 Na7 Nxb2 Rb1 Nc4 Rb4 Nd2 Rd1 Nxf3+ Kf1 Nxh2+ Kg1 Nf3+ Kg2 Nxg5 Rbd4 Bh3+ Kg3 Nge4+ Kxh3 Nxf2+ Kg2 Nxd1 Rxd1 Ne4 Rd4 Nc3 Rb4 Nxa2 Rxb7 Nc3 Rxe7 Nd5 Rc7 Nxc7,B21,Sicilian Defense: Smith-Morra Gambit #2,3
DiCTkvZH,True,1502780000000.0,1502780000000.0,64,mate,black,10+10,rv0209,1200,shivangithegenius,1002,e4 c5 Nf3 d6 Bb5+ Bd7 Bxd7+ Nxd7 O-O Ngf6 Nc3 g6 d3 Bg7 Bg5 O-O Nd5 Nxd5 exd5 Bxb2 Bh6 Bg7 Bxg7 Kxg7 Ng5 Kg8 d4 c4 c3 e5 Re1 Qxg5 Qa4 Rfd8 Qa3 exd4 cxd4 Qxd5 Rad1 Re8 Re3 Rxe3 fxe3 b6 Re1 Nf6 Qc3 Ne4 Qb4 c3 Rc1 Rc8 Qa4 a5 Qd7 Rf8 Qa7 Qxa2 Qxb6 Qf2+ Kh1 Qd2 Rg1 Nf2#,B52,Sicilian Defense: Canal Attack |  Main Line,6
FSkgvV2E,True,1502780000000.0,1502780000000.0,54,resign,white,10+10,vihaandumir,1203,shivangithegenius,1019,e4 c5 Nf3 d5 exd5 Qxd5 Nc3 Qe6+ Qe2 Qxe2+ Bxe2 Nf6 O-O g6 d3 Bg7 Nb5 Na6 Bf4 O-O d4 Bd7 dxc5 Bxb5 Bxb5 Nxc5 Be3 Ne6 Nd4 a6 Bd3 Nxd4 Bxd4 Rad8 Bb6 Rd6 Bc5 Rd7 Rfe1 Re8 c3 Nd5 Bc2 Rc7 Ba3 b5 Rad1 Rd7 c4 e6 cxd5 exd5 Rxe8+ Bf8,B27,Sicilian Defense,3
F1mRjzPr,False,1502720000000.0,1502720000000.0,21,resign,black,15+3,shivangithegenius,1019,shamlanaseer,1500,d4 d5 c4 dxc4 e4 b5 Na3 a6 Qf3 f6 e5 fxe5 Qxa8 Nd7 dxe5 Nxe5 Qf3 Qd4 Qh5+ g6 Qd1,D20,Queen's Gambit Accepted: Central Variation |  Greco Variation,6
Lq24M4KQ,False,1502430000000.0,1502430000000.0,11,resign,white,18+0,medovich,1422,shivangithegenius,975,e4 c5 Bc4 Nf6 d3 d6 Nf3 g6 Ng5 Bg7 Nxf7,B20,Sicilian Defense: Bowdler Attack,3
lHNM8cl5,True,1502430000000.0,1502430000000.0,19,resign,black,10+0,shivangithegenius,976,sorethea,1832,d4 g6 e4 Bg7 Bf4 e6 Bc4 Ne7 Nf3 h6 Ne5 O-O Qg4 d5 exd5 exd5 Bd3 Bxg4 Bxg6,B06,Robatsch (Modern) Defense,4
GfeEgLV3,True,1502430000000.0,1502430000000.0,28,resign,white,10+0,rico21,1569,shivangithegenius,978,d4 d5 e4 dxe4 Nc3 Nf6 f3 exf3 Nxf3 Bf5 Bd3 Bxd3 Qxd3 Nc6 O-O Nb4 Qf5 Nc6 d5 Nxd5 Nxd5 e6 Qf4 exd5 Nd4 Ne7 Qxf7+ Kd7,D00,Blackmar-Diemer Gambit: Tartakower Variation,10
OR6aULrW,False,1502210000000.0,1502210000000.0,22,resign,black,15+0,shivangithegenius,978,jojo58,1500,d4 Nf6 Nc3 d6 d5 g6 e4 Bg7 Nf3 O-O Ng5 a6 Qf3 c6 Qg3 b5 Qh4 h6 Nf3 g5 Qxg5 hxg5,A45,Indian Game,2
Yg006qwa,False,1502210000000.0,1502210000000.0,37,resign,white,15+0,jojo58,1500,shivangithegenius,978,e4 c5 Nf3 d6 d4 cxd4 Nxd4 Nf6 Nc3 g6 Be3 Bg7 Bc4 O-O f3 Nc6 Qd2 a6 O-O-O b5 Bb3 Na5 Kb1 Nxb3 cxb3 d5 Nc6 Qd7 exd5 Nxd5 Qxd5 Qf5+ Qxf5 Bxf5+ Ka1 Rac8 Nxe7+,B77,Sicilian Defense: Dragon Variation |  Yugoslav Attack |  Main Line,17
G5S21pXK,False,1502030000000.0,1502030000000.0,34,resign,white,30+30,rajuppi,2449,shivangithegenius,978,c4 e5 Nc3 Bc5 g3 Nc6 Bg2 Nf6 Nf3 b6 Nxe5 Bb7 Nd3 Bd4 O-O Bxc3 dxc3 O-O Nb4 Re8 Nxc6 Bxc6 Bxc6 dxc6 Be3 Ng4 Qxd8 Raxd8 Rad1 Nxe3 fxe3 Rxd1 Rxd1 Rxe3,A21,English Opening: King's English Variation |  Reversed Sicilian,3
R9a2DLwe,False,1499700000000.0,1499700000000.0,32,draw,draw,20+25,white_queen_1990,1207,shivangithegenius,978,e4 c5 Nf3 d6 d4 cxd4 Nxd4 Nf6 Nc3 g6 Bg5 Bg7 Bxf6 Bxf6 Bb5+ Bd7 Bxd7+ Nxd7 O-O Bxd4 Qxd4 O-O f3 Qb6 Qxb6 Nxb6 Nd5 Nxd5 exd5 Rac8 c3 Rc5,B70,Sicilian Defense: Dragon Variation,10
r4LcBZA7,False,1499700000000.0,1499700000000.0,71,resign,black,5+5,milestretch,1241,shivangithegenius,978,e4 c5 Nc3 d6 Bc4 Nf6 Qe2 g6 e5 dxe5 Qxe5 Qd4 Bb5+ Bd7 Bxd7+ Nbxd7 f4 Nxe5 fxe5 Qxe5+ Nge2 Ne4 Nxe4 Qxe4 O-O Qxc2 Nf4 Bh6 Nd5 Rc8 b4 Bxd2 b5 Bxc1 Raxc1 Qxa2 b6 Qxd5 bxa7 Qd4+ Kh1 e5 Ra1 O-O Rfb1 Qd7 g3 Qc6+ Kg1 c4 Re1 Qc5+ Kf1 Ra8 Reb1 Rxa7 Rxa7 Qxa7 Rd1 Qa4 Rd5 c3 Ke1 c2 Kd2 Qb3 Rxe5 Qb2 Re1 c1=Q+ Kd3,B23,Sicilian Defense: Closed Variation,3
SDDXGw21,False,1499620000000.0,1499620000000.0,30,resign,white,30+0,stephen789,1500,shivangithegenius,978,e4 c5 d4 cxd4 Qxd4 Nc6 Qa4 Nf6 Nf3 g6 Bg5 Qa5+ Qxa5 Nxa5 Nbd2 Bg7 Bxf6 Bxf6 O-O-O e6 e5 Bg5 Bd3 Bxd2+ Nxd2 O-O h4 h6 Nf3 f6,B21,Sicilian Defense: Smith-Morra Gambit #2,3
oqoT4DLS,False,1499610000000.0,1499620000000.0,66,resign,white,40+40,rajuppi,2443,shivangithegenius,978,e4 c5 Nf3 d6 d4 cxd4 Nxd4 Nf6 Nc3 g6 Be3 Bg7 f3 O-O Qd2 Nc6 O-O-O d5 exd5 Nxd5 Nxc6 bxc6 Nxd5 cxd5 Qxd5 Qc7 Qc5 Qb7 b3 Bf5 Bd3 Rac8 Qa3 Bxd3 Rxd3 Qc7 c4 Qe5 Kc2 Rfd8 Rhd1 Rxd3 Rxd3 Rc6 Rd8+ Bf8 Qxa7 Rd6 Rxd6 exd6 Qd4 Qf5+ Qd3 Qf6 Bd4 Qf5 Qxf5 gxf5 a4 Bg7 Bxg7 Kxg7 a5 f4 a6 Kf8,B76,Sicilian Defense: Dragon Variation |  Yugoslav Attack |  Modern Line,17
eSociDPG,False,1499330000000.0,1499330000000.0,41,resign,white,20+0,hmbrgr,1500,shivangithegenius,978,e4 c5 d4 cxd4 Qxd4 Nc6 Qe3 Nf6 e5 Qa5+ c3 Nxe5 f4 Neg4 Qf3 Ne5 fxe5 Qxe5+ Be2 d5 Bf4 Qe4 Nd2 Qxf3 Ndxf3 Bg4 Rd1 Bxf3 Bxf3 e6 c4 dxc4 Ne2 Bb4+ Nc3 Rd8 O-O Rd3 Rxd3 cxd3 Rd1,B21,Sicilian Defense: Smith-Morra Gambit #2,3
mpzYDfIK,False,1499330000000.0,1499330000000.0,49,resign,white,15+0,jjwrchess,1500,shivangithegenius,978,e4 c5 Bc4 Nc6 Nc3 d6 d3 Nf6 Nge2 g6 O-O Nd4 f4 e5 fxe5 dxe5 Bg5 Bg7 Nd5 Be6 Bxf6 Bxf6 Nxf6+ Ke7 Bxe6 fxe6 c3 Nxe2+ Qxe2 Rf8 Nxh7 Rxf1+ Rxf1 Ke8 Qg4 Ke7 Qxg6 Qxd3 Qf6+ Kd6 Ng5 Qe3+ Kh1 Re8 Nf7+ Kd7 Nxe5+ Kd6 Nc4+,B20,Sicilian Defense: Bowdler Attack,3
27zreJYy,False,1499330000000.0,1499330000000.0,3,resign,black,15+0,shivangithegenius,978,jjwrchess,1500,e4 d5 exd5,B01,Scandinavian Defense,2
IRYkgI8N,False,1499320000000.0,1499320000000.0,7,resign,white,10+0,adnanraj,1343,shivangithegenius,978,e4 c5 Bc4 Nf6 e5 Ne4 Nf3,B20,Sicilian Defense: Bowdler Attack,3
tLnhk43J,False,1499010000000.0,1499010000000.0,35,mate,white,40+40,rajuppi,2436,shivangithegenius,978,e4 c5 Nf3 d6 d4 cxd4 Nxd4 Nf6 Nc3 g6 Be3 Bg7 f3 O-O Qd2 Nc6 Bc4 Be6 Bxe6 Nxd4 Bxf7+ Rxf7 Bxd4 d5 e5 Ne8 e6 Rf8 O-O-O Bxd4 Qxd4 Qa5 Nxd5 Rc8 Nxe7#,B77,Sicilian Defense: Dragon Variation |  Yugoslav Attack |  Main Line,17
iq3Kz06t,False,1498400000000.0,1498410000000.0,41,mate,white,40+40,rajuppi,2436,shivangithegenius,978,e4 d5 exd5 Qxd5 Qf3 Qe5+ Ne2 Nf6 d4 Qd5 Qxd5 Nxd5 a3 Nb6 Ng3 Nc6 Be3 e5 dxe5 Nxe5 Nd2 Be6 O-O-O Nbc4 Nxc4 Nxc4 Bxc4 Bxc4 Rhe1 Be7 Nf5 Be6 Nxg7+ Kf8 Bh6 Bg4 f3 Be6 Nxe6+ Ke8 Nxc7#,B01,Scandinavian Defense: Mieses-Kotroc Variation,4
AAw1TiNN,False,1497980000000.0,1497980000000.0,5,resign,black,10+0,shivangithegenius,978,balkarec,1500,d4 e6 e4 Qh4 Nc3,C00,French Defense: Normal Variation,3
n4vRYUCW,False,1497900000000.0,1497900000000.0,7,resign,white,10+0,lucasimeon,1500,shivangithegenius,978,e4 e5 d4 d5 Nf3 dxe4 Nxe5,C21,King's Pawn Game: Beyer Gambit,4
KYPdQv8e,False,1497890000000.0,1497900000000.0,53,mate,white,10+0,shivangithegenius,978,lucasimeon,1500,d4 f5 e3 Nf6 Nc3 d5 Bb5+ c6 Bd3 b5 Qf3 Qa5 Bxf5 Nbd7 Bxd7+ Bxd7 a3 Bg4 Qf4 h5 b4 Qb6 h3 Be6 Nf3 c5 bxc5 Qa5 Bb2 Rb8 Qxb8+ Kd7 Qb7+ Kd8 Qa8+ Bc8 c6 Qc7 Nxb5 Qxc6 Qxc6 Ne4 Qc7+ Ke8 Qxc8+ Kf7 Ne5+ Kf6 Nc7 e6 Qxe6+ Kg5 h4#,A80,Dutch Defense,2
p30PeXvE,False,1497890000000.0,1497890000000.0,36,resign,black,10+0,lucasimeon,1500,shivangithegenius,978,c4 e5 b3 d5 Bb2 e4 d4 exd3 Qxd3 Nf6 Be5 dxc4 bxc4 Bb4+ Nc3 Bxc3+ Qxc3 Ne4 Qh3 Ng5 Qa3 Ne4 Bxg7 Rg8 Qa4+ Bd7 Bf6 Qxf6 Nf3 Bxa4 e3 Qxa1+ Ke2 Qxa2+ Kd3 Nxf2+,A20,English Opening: King's English Variation,2
PBS4FEld,True,1503220000000.0,1503230000000.0,8,resign,white,16+0,wing175,1521,gerfsh,1162,Nf3 e5 Nxe5 Ke7 e4 Kd6 d4 Nc6,A04,Zukertort Opening: Ross Gambit,2
0lDqWVlz,True,1503180000000.0,1503180000000.0,3,resign,white,6+10,caramiecho72,1407,gerfsh,1500,e4 c5 Nc3,B23,Sicilian Defense: Closed Variation,3
O3wdIwg7,True,1504260000000.0,1504260000000.0,28,resign,white,10+0,mazyaraghgmail,1492,wpc96,1458,e4 e5 a3 Nf6 Nc3 d5 exd5 Nxd5 Nxd5 Qxd5 Qf3 e4 Qe3 Bc5 Qg3 O-O Ne2 Re8 Qxc7 Bd6 Qc3 Be5 Qe3 Bd4 Qxd4 Qxd4 Nxd4 Bf5,C26,Vienna Game: Mengarini Variation,5
48ktrxLp,True,1504250000000.0,1504250000000.0,30,resign,black,10+0,anrk,1414,wpc96,1442,e4 e5 Nf3 d6 d4 exd4 Nxd4 g6 Bc4 Nf6 Bg5 Bg7 O-O O-O Nc3 h6 Bxf6 Bxf6 Re1 Re8 Nd5 c5 Nf3 Bxb2 Rb1 Bf6 Nxf6+ Qxf6 Qxd6 Qxd6,C41,Philidor Defense: Larsen Variation,8
i2GBGO0R,True,1504140000000.0,1504140000000.0,44,resign,black,10+0,wpc96,1457,tbaruel,1294,e4 e5 Nf3 Nc6 d4 Bb4+ c3 Bd6 d5 Nce7 c4 c6 Be2 Nf6 Bg5 Nxe4 Bxe7 Qxe7 dxc6 dxc6 Bd3 Nc5 O-O f5 Re1 e4 Bc2 O-O Nd4 Qe5 Nf3 Qf4 Nd4 Qxh2+ Kf1 Be5 Nf3 exf3 Qxf3 Bxb2 Nc3 Bxa1 Rxa1 Qh1+,C44,Scotch Game,5
QZSTu1aT,True,1504140000000.0,1504140000000.0,29,resign,white,10+0,acahn,1525,wpc96,1466,e4 e5 Nf3 d6 Bc4 f5 exf5 Bxf5 Nc3 e4 Nd4 Bg6 Qg4 Nf6 Qe6+ Qe7 Qc8+ Qd8 Qxb7 Nbd7 Nc6 Qc8 Qxc8+ Rxc8 Nxa7 Ra8 Nab5 c6 Nc7+,C41,Philidor Defense: Lopez Countergambit,6
9tU9MM6P,True,1504230000000.0,1504230000000.0,37,resign,black,8+10,iskendermyucel,1207,oldpaths,1579,e4 e6 Nf3 d5 exd5 exd5 d4 Bg4 c4 Bb4+ Bd2 Qe7+ Be2 Bxf3 Bxb4 Qxb4+ Nc3 Bxe2 Qxe2+ Ne7 O-O O-O a3 Qd6 cxd5 Nxd5 Qe4 Nxc3 Qxb7 Nc6 bxc3 a5 h3 Rfb8 Qxa8 Rxa8 Rfe1,C00,French Defense: Knight Variation,3
ztpC1S2c,True,1503970000000.0,1503970000000.0,49,resign,white,8+12,oldpaths,1567,david1488,1573,d4 g6 Nf3 Bg7 Bf4 d6 e3 Nd7 c3 e5 Bg3 Ne7 Nbd2 O-O a4 f5 Bh4 exd4 Qb3+ Kh8 exd4 Qe8 Qd1 Nd5+ Be2 Nf4 Kf1 Nxe2 Qxe2 Qxe2+ Kxe2 Re8+ Kd3 c5 Rhe1 Rf8 Ng5 cxd4 cxd4 b6 Ne6 Rf7 Nc4 Ba6 b4 b5 Nxd6 bxa4+ b5,A40,Modern Defense,2
qc8aH5XL,True,1503970000000.0,1503970000000.0,32,resign,black,8+12,oldpaths,1578,lc777,1605,d4 e6 Bf4 c5 c3 Qb6 b3 cxd4 cxd4 Bb4+ Bd2 Qxd4 e3 Qxa1 Bxb4 Qf6 Bc3 Qg6 Nf3 h6 Ne5 Qg5 h4 Qe7 Qf3 Nf6 a3 d6 Bb5+ Kf8 Bb4 a5,A40,Horwitz Defense,2
6sTz6t7D,True,1503970000000.0,1503970000000.0,25,resign,white,8+12,jordanfury,1939,oldpaths,1581,d4 Nf6 c4 e6 Nf3 c5 d5 exd5 cxd5 c4 Nc3 Bb4 Bg5 Bxc3+ bxc3 h6 Bh4 g5 Bg3 Ne4 Qd4 Qf6 Qxe4+ Kf8 Be5,E10,Blumenfeld Countergambit #2,6
XuyVUkDi,True,1503970000000.0,1503970000000.0,40,mate,black,5+10,porquepepe,1618,oldpaths,1568,e4 e6 Bc4 d5 exd5 exd5 Bb3 Qe7+ Ne2 Nf6 d4 Nc6 O-O Bf5 Bg5 h6 Bxf6 Qxf6 Bxd5 Nb4 Bb3 O-O-O a3 Nc6 c3 Bd6 Ng3 g6 Nd2 h5 Nge4 Bxe4 Nxe4 Bxh2+ Kh1 Qh4 f3 Bg3+ Kg1 Qh2#,C00,French Defense #2,2
D5Oa4vGO,True,1503960000000.0,1503960000000.0,39,resign,white,7+12,gio1212,1755,oldpaths,1574,Nf3 g6 g3 Bg7 Bg2 e6 O-O Ne7 c3 c5 d4 Qb6 dxc5 Qxc5 Be3 Qb5 b4 Nd5 a4 Qc4 Ra3 Bxc3 Nxc3 Nxc3 Qd3 Nxe2+ Kh1 Nxg3+ fxg3 Qxb4 Ne5 Qe7 Nxf7 Rf8 Nd6+ Kd8 Rxf8+ Qxf8 Bg5+,A04,Zukertort Opening: Kingside Fianchetto,2
6QAiH2Yy,True,1503890000000.0,1503890000000.0,57,resign,white,15+10,oldpaths,1561,rubberchicken04,1596,d4 Nf6 Bf4 c5 e3 cxd4 exd4 d5 Nf3 Bg4 h3 Bxf3 Qxf3 Nc6 Bb5 e6 Nc3 Bb4 a3 Ba5 b4 Bb6 Bxc6+ bxc6 Ne2 a5 O-O O-O Be5 Ne4 Qg4 Qg5 Qxg5 Nxg5 c3 f6 Bf4 Nf7 Rfd1 e5 Bc1 exd4 Nxd4 Bxd4 Rxd4 Nd6 h4 Nb5 Rd3 Rfc8 Be3 Rd8 Bb6 Rdb8 bxa5 Nd6 Bc7,A45,Indian Game,2
l7top9ps,True,1503810000000.0,1503810000000.0,78,resign,black,5+40,berejokserg,1500,oldpaths,1554,e4 e6 Nc3 Bb4 Nge2 Ne7 a3 Bxc3 Nxc3 d5 d4 Nd7 e5 c5 Be3 Nf5 Qd2 Nxe3 Qxe3 cxd4 Qxd4 O-O Bd3 Qg5 f4 Qe7 O-O b6 Rf3 Nc5 Rh3 Nxd3 Qxd3 g6 Rh6 Kg7 Qh3 Qc5+ Kh1 Rh8 Rh4 Bb7 Qf3 Rab8 Rc1 d4 Na4 Bxf3 Nxc5 bxc5 gxf3 Rxb2 c3 d3 Rg4 d2 Rd1 Rd8 Rg2 Rc2 a4 Rc1 Rgg1 Rxc3 Kg2 Rdd3 Rgf1 c4 Kf2 Rxf3+ Ke2 Rxf1 Kxf1 Rc1 Ke2 c3 Kd3 Rxd1,C00,French Defense: Queen's Knight,3
nG3Of11I,True,1503790000000.0,1503790000000.0,61,resign,white,15+5,oldpaths,1544,trump216bc,1461,d4 d5 Bf4 e6 Nf3 c5 c3 Nc6 e3 Nf6 Nbd2 Bd6 Bg3 cxd4 cxd4 Qb6 Bxd6 Nb4 Bxb4 Qxb4 b3 Bd7 Be2 h6 O-O g5 Ne5 O-O-O Nxf7 g4 Nxh8 Rxh8 f3 h5 fxg4 hxg4 Rxf6 Qe7 Qc2+ Kb8 Rff1 Qh4 Rf8+ Rxf8 g3 Qf6 Rf1 Qg7 Bxg4 Rxf1+ Kxf1 Qxg4 Kf2 Bb5 Nf3 Be8 Ne5 Qh3 Kg1 Bh5 Nd7+,D00,Queen's Pawn Game: Mason Attack,3
cUzM68JF,True,1503710000000.0,1503710000000.0,44,resign,black,20+5,oldpaths,1563,efer003,1335,d4 d5 Bf4 Nc6 Nf3 f6 e3 g5 Bg3 a6 Bd3 g4 Nfd2 f5 h3 Nh6 Nc3 Bg7 O-O O-O hxg4 Nxg4 Be2 h5 Nb3 e5 Nc5 f4 exf4 exf4 Bxg4 hxg4 Bh2 Bxd4 Nxb7 Qh4 g3 fxg3 Bxg3 Qxg3+ Kh1 Qh3+ Kg1 g3,D00,Queen's Pawn Game: Mason Attack,3
NZSBXWl2,True,1503710000000.0,1503710000000.0,62,mate,black,20+5,oldpaths,1579,fcolpo,1470,d4 d6 Bf4 e6 Nf3 Nc6 e3 Nf6 Nbd2 d5 Bb5 Bd7 a3 a6 Bxc6 Bxc6 Ne5 Bd7 O-O g6 c4 Bg7 cxd5 exd5 Qb3 Ne4 Nxf7 Kxf7 Qxd5+ Be6 Qxe4 Re8 Qxb7 Bd5 Qxc7+ Kg8 Qxd8 Rexd8 Rac1 h6 f3 g5 Be5 Bf8 e4 Bf7 d5 Rd7 Nc4 Rb7 b4 Be8 Bd6 Bb5 Bxf8 Kxf8 Rf2 Rc8 Nd6 Rxc1+ Rf1 Rxf1#,A41,Queen's Pawn,2
DHuXFP6C,True,1503700000000.0,1503700000000.0,87,mate,white,20+5,chesschumpchamp,1617,oldpaths,1590,d4 Nf6 e3 g6 f4 Bg7 Nf3 d5 c4 O-O Nc3 c6 Bd3 e6 Qc2 Na6 a3 c5 cxd5 exd5 O-O c4 Be2 Bf5 Qd1 Nc7 Ne5 Ne4 Nxe4 Bxe4 Bf3 Bxf3 Rxf3 f6 Ng4 h5 Nf2 f5 Rg3 Kh7 Nh3 h4 Ng5+ Kh6 Rh3 Bf6 Rxh4+ Kg7 Rh7+ Kg8 Rh6 Bxg5 Rxg6+ Kf7 Rxg5 Ke6 Qh5 Rf6 Bd2 Qh8 Rf1 Qxh5 Rxh5 Rg8 Rf3 Rfg6 g3 Ne8 Rh7 Nd6 Bb4 Ne4 Rxb7 c3 Bxc3 Nxc3 bxc3 Ra8 Rf1 Rgg8 Rfb1 Rgd8 Rh7 Rdc8 Rbb7 Rxc3 Rh6#,A45,Indian Game,2
00R4UOcU,True,1503700000000.0,1503700000000.0,54,mate,black,20+5,aminox,1207,oldpaths,1588,e4 e6 d4 d5 e5 c5 dxc5 Bxc5 Nf3 Nc6 c3 Qc7 b4 Bb6 Na3 a6 Qa4 Bd7 b5 Nxe5 Bf4 Nd3+ Bxd3 Qxc3+ Ke2 Qb2+ Bc2 Ne7 Rhb1 Qf6 Be5 Qh6 Qg4 Ng6 Bd4 e5 Qg5 exd4 Qxd5 Nf4+ Kf1 Nxd5 Re1+ Kd8 Ne5 Qf4 g3 Qf6 Nxd7 Kxd7 Red1 d3 Rxd3 Qxf2#,C02,French Defense: Advance |  Steinitz Variation,7
IN15cBnB,True,1503690000000.0,1503690000000.0,54,resign,black,15+5,oldpaths,1595,sale0706,1547,d4 d5 Bf4 Nc6 e3 Nf6 Nf3 Bg4 h3 Bh5 c4 e6 Nbd2 Bb4 a3 Bxd2+ Qxd2 Bxf3 gxf3 O-O b4 Nh5 b5 Nxf4 bxc6 Ng6 cxb7 Rb8 Rb1 c6 c5 Re8 Ba6 e5 Ke2 exd4 Qxd4 Qa5 Bd3 Re7 h4 Ne5 h5 Nxd3 Kxd3 Rexb7 Rxb7 Rxb7 Rg1 Qxa3+ Kc2 Qa2+ Kd3 Rb3+,D00,Queen's Pawn Game: Mason Attack,3
WYOts2ME,True,1503690000000.0,1503690000000.0,37,resign,white,15+5,redar1,1855,oldpaths,1599,e4 e6 d4 d5 exd5 exd5 Bd3 Bd6 h3 Ne7 Nf3 O-O O-O Bf5 a3 Nbc6 Re1 Re8 b3 Ng6 Bxf5 Qf6 Bxg6 hxg6 Nc3 Rxe1+ Qxe1 Nxd4 Nxd4 Qxd4 Rb1 Kf8 Nb5 Re8 Qxe8+ Kxe8 Nxd4,C01,French Defense: Exchange Variation,5
oWFQ8mnz,True,1503690000000.0,1503690000000.0,50,resign,white,15+5,oldpaths,1589,insequitur,1547,d4 e6 Bf4 h6 Nf3 d6 e4 Qf6 Qd2 Nc6 Bb5 Bd7 Nc3 a6 Bxc6 bxc6 e5 Qd8 exd6 cxd6 O-O Nf6 Rae1 Be7 a4 d5 Ne5 Bb4 b3 Ne4 Qd3 Bxc3 Rxe4 dxe4 Qxc3 Rc8 Nxd7 Qxd7 d5 cxd5 Qxg7 Rf8 Bxh6 Qe7 c3 Rg8 Qxg8+ Kd7 Qg7 Rxc3,A40,Horwitz Defense,2
i2I8y9Xh,True,1503690000000.0,1503690000000.0,131,resign,white,30+0,oldpaths,1571,tb-123,1728,d4 Nf6 Bf4 d5 Nf3 e6 c4 Bd6 Bg3 Bxg3 hxg3 h6 Nbd2 c5 e3 cxd4 exd4 Nc6 cxd5 exd5 Bb5 Qe7+ Qe2 Qxe2+ Bxe2 a6 Rc1 O-O Nb3 Ne4 Nc5 Nxc5 dxc5 Be6 O-O Rac8 a3 a5 Bb5 Bg4 Bxc6 bxc6 Ne5 Be6 f4 f5 Ng6 Rfe8 Rf3 Bf7 Ne5 Re7 Nxf7 Rxf7 Rb3 Ra7 Rb6 Kf7 Re1 a4 Kh2 Rcc7 Kh3 Ra5 Rc1 Rb5 Rxb5 cxb5 Kh4 g6 g4 fxg4 Kxg4 Kf6 g3 h5+ Kf3 Kf5 Ke3 Kg4 Kf2 Rc6 Rc3 h4 gxh4 Kxf4 Rf3+ Ke4 Rg3 Rxc5 Rxg6 Rc2+ Kg3 Rxb2 h5 Rb3+ Kg4 Rxa3 h6 Ra1 Rg5 Rh1 Rh5 Rg1+ Kh3 d4 h7 Rh1+ Kg4 Rg1+ Kh3 Kf4 Rh4+ Kf3 Rf4+ Kxf4 Kh2 Re1 h8=Q d3 Qd4+ Re4 Qxd3 b4 Qd2+ Ke5 Qg5+ Kd4 Qa5 Re2+ Kg3,D02,Queen's Pawn Game: London System,5
osPCRdxJ,True,1503680000000.0,1503690000000.0,48,resign,white,30+0,tb-123,1720,oldpaths,1579,e4 e6 Qe2 c5 Nf3 Nc6 g3 g6 Bg2 Bg7 O-O Nge7 c3 O-O d3 b6 Na3 a6 Re1 d6 Nc4 b5 Ne3 b4 Qc2 bxc3 bxc3 Nb4 Qd2 a5 Rb1 Nbc6 Ng5 h6 Nf3 Ba6 Ba3 a4 d4 Qa5 e5 cxd4 cxd4 Qxd2 Nxd2 Nxd4 Bxa8 Nc2,C00,French Defense: Chigorin Variation,3
Mi1AmkiI,True,1503620000000.0,1503620000000.0,47,resign,black,15+5,oldpaths,1579,iris_foxspring,2105,d4 d5 Bf4 Nf6 Nf3 e6 e3 Bd6 Bg3 O-O Bd3 b6 Nbd2 Bb7 a3 Nbd7 c4 Bxg3 hxg3 Re8 Qb1 h6 e4 dxe4 Nxe4 e5 d5 c6 Nd6 e4 Nxe8 Qxe8 Bxe4 cxd5 cxd5 Ba6 Nd2 Nc5 f3 Qe5 Kd1 Qd4 Rh4 Qf2 Kc2 Rc8 Bd3,D02,Queen's Pawn Game: London System,5
7kK30TmL,True,1503550000000.0,1503550000000.0,64,mate,black,15+5,zoro55,1768,oldpaths,1560,e4 e6 f4 d5 e5 c5 Nf3 Nc6 c3 Nh6 d4 cxd4 cxd4 Qa5+ Bd2 Bb4 Nc3 Nf5 Bb5 Bxc3 Bxc6+ bxc6 Bxc3 Qb6 O-O Ne3 Qe2 Nxf1 Rxf1 Ba6 Qf2 Bxf1 Qxf1 c5 dxc5 Qxc5+ Bd4 Qa5 a3 Rc8 h3 O-O Qd3 Rc1+ Kh2 Rfc8 Ng5 g6 Qg3 Qe1 Qxe1 Rxe1 Bxa7 Rc2 b4 Ree2 b5 Rxg2+ Kh1 Ra2 b6 Rgb2 a4 Ra1#,C00,French Defense: La Bourdonnais Variation,3
ThCXomTn,True,1503540000000.0,1503540000000.0,61,resign,white,15+5,oldpaths,1552,geburah,1436,d4 d5 Bf4 Nf6 e3 g6 Nf3 Bg7 c4 dxc4 Bxc4 O-O Qb3 e6 O-O c6 Nbd2 b5 Bd3 Bb7 a4 a6 Ne4 Nxe4 Bxe4 Qe7 Ne5 Bxe5 Bxe5 Nd7 Bg3 Ra7 axb5 cxb5 Bxb7 Rxb7 Rxa6 Nf6 Bd6 Qd7 Bxf8 Kxf8 Ra8+ Kg7 Rc1 Qd6 Rc5 Ng4 g3 e5 dxe5 Qd2 Rc2 Qe1+ Kg2 Rd7 e6 Rd2 Qc3+ Kh6 Qxd2,D00,Queen's Pawn Game: Mason Attack,3
