id,rated,created_at,last_move_at,turns,victory_status,winner,increment_code,white_id,white_rating,black_id,black_rating,moves,opening_eco,opening_name,opening_ply
MeJ86Rct,True,1501070000000.0,1501070000000.0,19,resign,white,10+10,losteroo,1237,zixi52,1565,e4 e5 Nf3 Nc6 Bc4 Nf6 Ng5 Bc5 Nxf7 Bxf2+ Kxf2 Nxe4+ Ke3 Qh4 Qf3 Qe1+ Rxe1 Nc5 Nxh8,C57,Italian Game: Two Knights Defense |  Traxler Counterattack |  Knight Sacrifice Line,9
JkHzVMgg,True,1501070000000.0,1501070000000.0,98,mate,black,15+0,zixi52,1753,tokbora,1451,d4 d5 Nf3 Nf6 Nbd2 e6 e3 Bb4 Bd3 O-O b3 b6 Bb2 Nc6 O-O Re8 Qe2 h6 a3 Bd6 Rad1 Ng4 g3 f5 Rfe1 Qd7 Nh4 Qf7 f4 Be7 Nhf3 Qh5 b4 a5 b5 Na7 a4 c6 bxc6 Nxc6 Bb5 Bd7 h4 Rad8 c3 Na7 Nf1 Bxb5 axb5 Rc8 Rd2 Red8 c4 Bb4 cxd5 Bxd2 Qxd2 Rxd5 Rc1 Rxc1 Qxc1 Nxb5 Qc8+ Kf7 Qb7+ Kf6 Qxb6 Nd6 Ba3 Ne4 N1d2 Nxe3 Nxe4+ Kf7 Qc7+ Kg6 Ne5+ Rxe5 Kf2 Rxe4 Qd8 Nd1+ Kg2 Qe2+ Kh3 Nf2+ Kh2 Nd3+ Kh3 Qg4+ Kg2 Re2+ Kf1 Qf3+ Kg1 Qf2+ Kh1 Re1#,D02,Queen's Pawn Game: Symmetrical Variation,4
qqdwmJyX,True,1501070000000.0,1501070000000.0,35,mate,white,15+0,zixi52,1699,tokbora,1457,d4 d5 Nf3 Nc6 Nbd2 e6 e3 Nf6 Bd3 Bd6 b3 O-O Bb2 a6 Qe2 Ng4 h3 Nf6 Ne5 Bxe5 dxe5 Nd7 Nf3 b5 h4 Bb7 Bxh7+ Kh8 Ng5 Ndxe5 Qh5 g6 Bxg6+ Kg8 Qh7#,D02,Queen's Pawn Game: Chigorin Variation,4
JVDhxVQw,False,1494200000000.0,1494200000000.0,41,mate,white,10+0,zixi52,1699,getrekt478,1500,e4 e5 Nf3 Nc6 Bb5 a6 Bxc6 bxc6 Nc3 Nf6 Nxe5 Bd6 d4 c5 Nf3 cxd4 Qxd4 O-O Be3 Ng4 Bd2 Bb7 O-O-O c5 Qxd6 Nxf2 Rdf1 Nxh1 Rxh1 Qc8 Qg3 Re8 Bh6 g6 Qg5 Re7 Qf6 Qf8 Bxf8 Kxf8 Qh8#,C68,Ruy Lopez: Exchange Variation |  Lutikov Variation,8
kgU4IzNb,True,1494090000000.0,1494090000000.0,75,mate,white,25+0,zixi52,1500,litvinartem,1545,d4 d5 Nf3 e6 Nbd2 f5 e3 Nf6 Bd3 Bd6 b3 O-O Bb2 c6 c4 Nbd7 cxd5 cxd5 Ng5 Re8 O-O b6 f3 h6 Nh3 Rf8 e4 fxe4 fxe4 Nxe4 Nxe4 dxe4 Bxe4 Rb8 Qg4 e5 dxe5 Nxe5 Qe2 Bxh3 Bd5+ Kh8 Qe4 Bc5+ Bd4 Bxd4+ Qxd4 Qg5 Rae1 Rxf1+ Kxf1 Qf5+ Kg1 Qg5 Qxe5 Qxe5 Rxe5 Rc8 gxh3 Rc1+ Kg2 Rc2+ Kg3 Rxa2 Re8+ Kh7 Bg8+ Kg6 Re6+ Kg5 Bh7 Ra5 h4+ Kh5 Bg6#,D02,Queen's Pawn Game: Zukertort Variation,3
agYrEOBF,True,1501420000000.0,1501420000000.0,122,mate,black,10+0,hasan_al-banna,1364,cale83,1356,e4 d6 d4 g6 Nf3 Bg7 Bb5+ Bd7 Bxd7+ Qxd7 Nc3 e6 O-O Ne7 Be3 O-O Re1 c5 d5 e5 Qe2 f5 exf5 Qxf5 Nb5 Na6 Nxd6 Qf6 Nxb7 Nb4 Nxc5 Rfd8 c3 Nbxd5 Bg5 Qb6 b4 e4 Qxe4 Bxc3 Bxe7 Nxe7 Qxe7 Bxa1 Rxa1 Qxb4 h3 Rac8 a3 Qxc5 Qe6+ Kh8 Qf6+ Kg8 Qf4 Rf8 Qg5 Kg7 Qxc5 Rxc5 Nd4 Re8 f3 Rc4 Kf2 Rxd4 Re1 Rxe1 Kxe1 Rd3 a4 Ra3 Ke2 Rxa4 Kd3 Ra3+ Kc4 Ra2 Kb4 Rxg2 Kb5 Rh2 Ka6 Rxh3 Kxa7 Rxf3 Kb6 h5 Kc5 h4 Kd4 h3 Ke4 Rf8 Ke3 h2 Ke2 h1=Q Kd2 Rd8+ Ke3 Qh6+ Ke4 Qh4+ Ke5 Qf6+ Ke4 Re8+ Kd5 Qd8+ Kc4 Re7 Kc3 Rb7 Kc4 Rb8 Kc3 Rc8+ Kb3 Qb6+ Ka2 Ra8#,B07,Pirc Defense #5,3
PdTSbmqt,True,1501170000000.0,1501170000000.0,8,outoftime,black,10+0,hasan_al-banna,1374,aliagha18,1385,e4 e5 Nf3 Qf6 Bc4 Bc5 d3 h6,C40,King's Pawn Game: McConnell Defense,4
J71gph8j,True,1500710000000.0,1500710000000.0,90,outoftime,black,10+0,sanya66665433,1324,hasan_al-banna,1365,e4 e5 Nf3 Nc6 d4 exd4 Nxd4 Nxd4 Qxd4 Nf6 Nc3 d6 Bd3 Be6 h3 g6 Bg5 Bg7 O-O O-O Rae1 Nxe4 Qxe4 Qxg5 f4 Qc5+ Rf2 Bd4 Na4 Bxf2+ Kf1 Qd4 Qxd4 Bxd4 c3 Bg7 b3 Rae8 c4 Re7 f5 Bxf5 Rxe7 Bxd3+ Kg1 Bd4+ Kh2 f5 Rxc7 Rf7 Rc8+ Kg7 Rd8 Re7 Rxd6 Re1 Rxd4 Bb1 Nc3 b6 Rd7+ Kh6 Rxa7 f4 Rb7 f3 gxf3 Rc1 Nxb1 Rxb1 Rxb6 Rb2+ Kg3 Rxa2 c5 Ra5 c6 Rg5+ Kf2 Rc5 b4 Rc2+ Ke3 Rc3+ Kd4 Rxf3 c7 Rf4+ Kc5 Rf5+,C45,Scotch Game,7
EQuDgTpk,True,1500190000000.0,1500190000000.0,46,mate,black,10+0,hasan_al-banna,1376,sadusiek,1370,e4 e6 d4 d5 Nc3 c5 Nf3 a6 Bd3 Nc6 O-O cxd4 Ne2 dxe4 Bxe4 Nb4 Nexd4 f5 Bg5 Nf6 Bd3 e5 Re1 e4 Bxf6 Qxf6 c3 Nxd3 Qxd3 Bc5 Nd2 O-O Nxe4 fxe4 Qxe4 Qxf2+ Kh1 Bd6 Qd5+ Kh8 Qxd6 h6 h3 Bxh3 Rf1 Qxg2#,C10,French Defense: Marshall Variation,6
5zyzlYIk,True,1500190000000.0,1500190000000.0,29,resign,black,10+0,onecert,1340,hasan_al-banna,1366,e3 e5 Nc3 d5 Qh5 Nc6 Bb5 Nf6 Qxe5+ Be7 Nf3 a6 Bxc6+ bxc6 e4 O-O Ng5 Nxe4 Ncxe4 dxe4 Nxe4 Re8 O-O Bg5 Nxg5 Rxe5 Nxf7 Kxf7 Re1,A00,Van't Kruijs Opening,1
ltlIdCf7,True,1500190000000.0,1500190000000.0,51,mate,white,10+0,parkerb32,1278,hasan_al-banna,1380,e4 e5 Nf3 Nc6 Nc3 Nf6 d3 Bb4 Bd2 O-O a3 Ba5 b4 Bb6 Nd5 Nxd5 exd5 Ne7 Nxe5 Nxd5 c4 Nf6 c5 Qe8 Qe2 d6 Nc4 dxc5 Qxe8 Rxe8+ Be2 cxb4 Bxb4 Bd4 Rc1 Ng4 Kd2 Nxf2 Rhf1 Be3+ Nxe3 Ng4 Rxc7 Nxe3 Rfxf7 Nd5 Rxg7+ Kh8 Rxh7+ Kg8 Rcg7#,C46,Four Knights Game,6
Zy5zJ6s7,True,1500040000000.0,1500040000000.0,39,draw,draw,10+0,shahariar1501074,1250,hasan_al-banna,1382,d4 d5 g3 Nf6 Bg2 Bf5 g4 Bxg4 h3 Bf5 Nc3 e6 Bg5 Be7 Bxf6 Bxf6 e4 dxe4 Bxe4 Bxe4 Nxe4 Qxd4 Nxf6+ Qxf6 Ne2 Qxb2 Qb1 Qe5 f4 Qf6 c3 O-O Qxb7 Nd7 Qxc7 Rad8 Qxa7 e5 Qxd7,D00,Queen's Pawn Game,2
K3JuCS9b,True,1497450000000.0,1497450000000.0,94,outoftime,black,10+0,hasan_al-banna,1388,karlrossmann,1238,e4 e5 Nf3 Nc6 Bc4 h6 d3 Bc5 Nc3 Nf6 O-O O-O Re1 Re8 Be3 Bxe3 Rxe3 Nd4 Re1 c5 Ne2 d6 h3 Bd7 c3 Nxf3+ gxf3 a6 Ng3 b5 Bb3 Bxh3 f4 exf4 Nf5 Bxf5 exf5 Qd7 Qf3 Rad8 Qxf4 Nh5 Qf3 Nf6 Re2 d5 Rae1 c4 dxc4 dxc4 Bc2 a5 Rxe8+ Nxe8 Rd1 Qc7 Rxd8 Qxd8 Qc6 Qg5+ Kf1 Qc1+ Ke2 Qxc2+ Ke3 Nf6 Qxb5 Ng4+ Kf4 h5 Qxa5 Qxf2+ Ke4 Qe2+ Kf4 Qh2+ Ke4 Nf2+ Kd5 Qf4 Qd8+ Kh7 f6 Qe4+ Kc5 Nd3+ Kb5 Nxb2 Qd1 Qe5+ Qd5 Qxd5+ Kb6 Qd6+,C55,Italian Game: Anti-Fried Liver Defense,6
gMznYgSt,True,1496590000000.0,1496590000000.0,129,outoftime,white,10+0,webchessplayer,1301,hasan_al-banna,1401,Nf3 c5 g3 Nc6 Bg2 e6 d3 d5 O-O Nd4 Nxd4 cxd4 Nd2 Bd7 Nf3 Bc5 b3 Ne7 Ne5 Bc8 Qd2 O-O Qf4 Nf5 Qg4 Qf6 Nf3 e5 e4 dxe4 Qxe4 Re8 Nh4 Bd7 Nxf5 Qxf5 Qxb7 h6 Qd5 Rac8 Qb7 Qe6 Bd5 Qd6 Bc4 Qc6 Qxc6 Bxc6 Bd2 e4 Ba6 Rc7 dxe4 Bxe4 Bb5 Rec8 Ba5 Bb6 Bxb6 axb6 Ba6 Bb7 Bb5 Rxc2 Rae1 Bc6 Ba6 Rc7 Rc1 Rxc1 Rxc1 f6 Bc4+ Kh7 f3 Rd7 Bd3+ g6 Rxc6 Re7 Rxf6 Re3 Rf7+ Kg8 Bxg6 Rxf3 Rxf3 Kg7 Be4 Kg8 Bd3 Kg7 a4 h5 b4 Kg8 b5 Kg7 Rf5 Kg6 Rd5+ Kf6 Rxd4 Ke5 Rd8 Ke6 Rb8 Kd6 Rxb6+ Kc5 Rh6 Kb4 Rxh5 Kxa4 b6 Kb4 b7 Kc3 b8=Q Kxd3 Qf4 Kc3 Qf3+ Kc4 Re5 Kd4 Qe4+ Kc3 Rd5,A04,Zukertort Opening: Sicilian Invitation,2
YJVZJhbX,True,1496420000000.0,1496430000000.0,129,outoftime,white,10+0,hasan_al-banna,1390,lopezz,1423,e4 e5 Nf3 d6 d4 Bg4 Be2 Bxf3 Bxf3 exd4 Qxd4 Qf6 Qxf6 Nxf6 O-O Be7 Re1 Nbd7 Nc3 c6 Bg5 O-O Bxf6 Bxf6 Rad1 Ne5 Be2 Rad8 f4 Ng6 f5 Ne5 g4 g5 Rd2 b5 Red1 b4 Na4 Be7 c3 d5 exd5 cxd5 Rxd5 Rxd5 Rxd5 f6 Nc5 bxc3 bxc3 Rc8 Nd7 Kf7 Nxe5+ fxe5 Rxe5 Rxc3 Bb5 Rc2 a4 Rc1+ Kg2 Rc2+ Kf3 Rxh2 Bc4+ Kf6 Ra5 Rh3+ Ke4 Rh4 Rxa7 Rxg4+ Kd5 h5 a5 Rg2 a6 Rd2+ Kc6 Bd8 Rd7 Rxd7 Kxd7 Bb6 Kc6 Be3 Bd3 g4 Kb7 h4 Be2 g3 Bf3 h3 Kc6 g2 Bg4 g1=Q Bxh3 Qc1+ Kb7 Qb2+ Kc6 Qb6+ Kd7 Qa7+ Kc6 Qxa6+ Kd5 Qb5+ Kd6 Qc5+ Kd7 Qa7+ Kd6 Bf4+ Kd5 Qa5+ Kd4 Qb4+ Kd5 Qd6+ Kc4 Qc6+ Kd3 Qd5+ Kc3,C41,Philidor Defense,5
qelnGcKv,True,1496420000000.0,1496420000000.0,38,mate,black,10+0,hasan_al-banna,1403,brainlinks,1321,e4 e5 Nf3 c6 Nxe5 Qe7 d4 c5 c3 cxd4 cxd4 Qb4+ Nc3 Nc6 Nxc6 dxc6 a3 Qd6 Be2 Nf6 e5 Qe6 exf6 Qxf6 O-O Bd6 Re1 O-O Ne4 Bxh2+ Kf1 Qh4 Bf3 b6 g3 Ba6+ Be2 Qh3#,C40,King's Pawn Game: Gunderam Gambit,4
S8sX587A,True,1496420000000.0,1496420000000.0,68,resign,black,10+0,mrmikethe1,1384,hasan_al-banna,1393,d4 d5 e3 c5 dxc5 e5 b4 a5 c3 axb4 Bb5+ Nc6 Bxc6+ bxc6 a3 Bxc5 cxb4 Be7 h3 Nf6 Nf3 e4 Nd4 Bd7 O-O O-O Nc3 Bxb4 Na4 Be7 Nc3 c5 Nde2 d4 exd4 cxd4 Qxd4 Be6 Qxd8 Raxd8 Bg5 Rd3 Nxe4 Nxe4 Bxe7 Nd2 Rfe1 Re8 Bb4 f6 Nf4 Nb3 Rxe6 Rxe6 Nxe6 Nxa1 Nf4 Rd1+ Kh2 Nc2 Ne2 Nxb4 axb4 Rb1 f4 Rxb4 g4 Rb2,D00,Queen's Pawn Game #2,3
FRCJRlH1,True,1496420000000.0,1496420000000.0,56,resign,black,10+0,hasan_al-banna,1403,fernanvm,1387,e4 e6 d4 Nc6 Nf3 d5 e5 Nge7 Nc3 Nf5 Bb5 Bd7 Bxc6 Bxc6 O-O Bb4 a3 Bxc3 bxc3 Bb5 Re1 f6 c4 Ba4 cxd5 Qxd5 Qe2 Nxd4 Nxd4 Qxd4 exf6 Qxf6 Qxe6+ Qxe6 Rxe6+ Kd7 Re4 Bxc2 Bb2 Rae8 Rae1 Bxe4 Bxg7 Rhg8 Bc3 Rxg2+ Kf1 Rxh2 Rd1+ Kc8 Re1 Rh1+ Ke2 Bc6+ Kd2 Rhxe1,C00,French Defense: Normal Variation,3
iG3eQIg5,True,1496420000000.0,1496420000000.0,88,mate,black,10+0,guilis,1381,hasan_al-banna,1393,Nf3 Nc6 e3 d5 c4 d4 e4 e5 d3 Bg4 Be2 Nf6 Ng5 Bxe2 Qxe2 Be7 Qf3 O-O O-O a6 Bd2 Nb4 Bxb4 Bxb4 a3 Be7 Nd2 c5 Qf5 b5 Ndf3 bxc4 Nxe5 cxd3 Nexf7 Qb6 Qe6 Qxe6 Nxe6 Rxf7 e5 Ne4 Rfe1 Nxf2 b3 d2 Re2 d1=Q+ Rxd1 Nxd1 Nc7 Ne3 Re1 Raf8 h3 Bh4 Ra1 Rxc7 Kh2 Rf2 Rg1 Rxg2+ Rxg2 Nxg2 Kxg2 Re7 Kf3 Rxe5 Kf4 Re3 Kf5 Rxb3 Ke5 d3 Kd5 d2 Kxc5 d1=Q Kc4 Qc1+ Kd5 Bg3 Ke4 Qe3+ Kf5 Rb5+ Kg4 Qf4#,A04,Zukertort Opening: Black Mustang Defense,2
B6UA5TzQ,True,1496420000000.0,1496420000000.0,86,mate,black,10+0,hasan_al-banna,1405,jonjic,1362,e4 d5 exd5 Qxd5 Nc3 Qe6+ Be2 g6 d4 Qb6 Nf3 e6 O-O Bg7 Be3 Nc6 d5 Nd4 Nxd4 Qxb2 Bd2 Bxd4 Nb5 Be5 Bc3 Bxc3 Nxc7+ Kf8 Rb1 Qxa2 Nxa8 exd5 Nc7 d4 Nb5 Bb2 c3 Bf5 Bd3 a6 Bxf5 gxf5 Qxd4 f6 Qd8+ Kg7 Qd7+ Kg6 Nd6 h5 Qxf5+ Kg7 Ne8+ Kf7 Nd6+ Kg7 Qd7+ Kg6 Qf7+ Kg5 Ne4+ Kf5 Ng3+ Ke5 Rfe1+ Kd6 Rbd1+ Kc5 Qd5+ Qxd5 Rxd5+ Kxd5 Rd1+ Kc4 Ne2 Ne7 Rd4+ Kc5 Rd7 Nd5 Rxb7 Bxc3 Ra7 Re8 Nxc3 Re1#,B01,Scandinavian Defense: Mieses-Kotroc Variation,4
hh5Sx4z3,True,1496420000000.0,1496420000000.0,107,draw,draw,10+0,sedinho,1397,hasan_al-banna,1405,e4 c5 d4 cxd4 Qxd4 Nc6 Qd1 g6 Nf3 Bg7 e5 Nxe5 Nxe5 Bxe5 Qd5 d6 Bc4 Be6 Qb5+ Bd7 Qxb7 Qc8 Qd5 Be6 Qb5+ Bd7 Qb3 Be6 Bxe6 fxe6 Qb5+ Kf7 O-O Qxc2 Bg5 Bxb2 Na3 Qc3 Qb7 Rb8 Qxb8 Bxa1 Nb5 Qb2 Bc1 Qxa2 Nxa7 Nf6 Qxh8 Nd5 Qxh7+ Kf6 Qh4+ g5 Qh6+ Kf5 Qxg5+ Ke4 Re1+ Kd3 Qd2+ Qxd2 Bxd2 Kxd2 Rxa1 Nf4 h4 d5 g3 Nh3+ Kg2 d4 h5 Ng5 Nb5 d3 Kf1 Kc2 Ke1 d2+ Ke2 Ne4 f3 Nxg3+ Ke3 d1=Q Rxd1 Kxd1 h6 Nf5+ Ke4 Nxh6 Ke5 Nf7+ Kxe6 Ng5+ Kxe7 Nxf3 Kd7 Ne5+ Kd6 Nc4+ Kc5 Ne5 Nc3+ Kd2 Kd4,B21,Sicilian Defense: Smith-Morra Gambit #2,3
v8e4T6kZ,True,1496390000000.0,1496390000000.0,57,resign,white,10+0,hasan_al-banna,1397,majc,1327,e4 e5 Nf3 d6 d4 exd4 Nxd4 c5 Nf3 Nc6 Bg5 Be7 Bxe7 Qxe7 Nc3 Nf6 Qe2 O-O O-O-O Nd4 Nxd4 Bg4 Nd5 Qd7 Nxf6+ gxf6 f3 cxd4 fxg4 Kh8 Rxd4 Rac8 Qd3 Qxg4 Rxd6 Qf4+ Kb1 Qf2 a3 Rxc2 Qxc2 Qxc2+ Kxc2 Rc8+ Kb3 Rc1 Rxf6 Kg7 Rf2 a5 h3 b5 g4 Re1 Re2 Rxe2 Bxe2,C41,Philidor Defense: Exchange Variation #2,7
6zUtwmrU,True,1496390000000.0,1496390000000.0,13,resign,white,10+0,ronmexico90,1374,hasan_al-banna,1408,e3 e5 b3 d5 Bb2 Nc6 Bb5 Bd7 Bxc6 Bxc6 Bxe5 Bd6 Bxg7,A00,Van't Kruijs Opening,1
5buJ0IDu,True,1496390000000.0,1496390000000.0,82,resign,black,10+0,hasan_al-banna,1414,gemyej,1594,e4 Nf6 Nc3 d5 exd5 Nxd5 Nxd5 Qxd5 d4 Nc6 Nf3 Bg4 Be2 e5 dxe5 Qxd1+ Bxd1 O-O-O O-O Bxf3 Bxf3 Nxe5 Be2 Bc5 Be3 Bxe3 fxe3 f6 Rad1 Rhe8 Rxd8+ Rxd8 Rd1 Rxd1+ Bxd1 Nc4 b3 Nxe3 Bf3 Nxc2 Be4 Nb4 a4 g6 Kf2 f5 Bf3 Kd7 Bxb7 c6 Kf3 Kc7 Ba8 Nd5 b4 Nxb4 Kf4 Nd5+ Kg5 Nb6 Bxc6 Kxc6 Kh6 Nxa4 Kxh7 Nc5 Kxg6 f4 Kf6 Kd6 Kf7 Ne6 Ke8 a5 h4 a4 h5 Ng7+ Kf7 Nxh5 g4 fxg3,B02,Alekhine Defense: Scandinavian Variation,4
ICFjVzHU,True,1496390000000.0,1496390000000.0,63,mate,white,10+0,rahidd,1306,hasan_al-banna,1429,d4 d5 g3 g6 b3 Bg7 Bb2 Nf6 Bg2 O-O Nf3 Nc6 O-O e6 Ne5 Nxe5 dxe5 Nd7 f4 c6 e4 Qb6+ Bd4 Qc7 exd5 cxd5 Nc3 b6 Nb5 Qd8 Nd6 Ba6 c4 dxc4 bxc4 Rb8 Qa4 Bc8 Qxa7 Bb7 Bxb7 Rxb7 Qxb7 f6 Bxb6 Nxb6 Rab1 Nxc4 Nxc4 Qd4+ Kg2 Qxc4 a3 fxe5 fxe5 Bxe5 Rxf8+ Kxf8 Rf1+ Kg8 Qf7+ Kh8 Qf8#,D00,Queen's Pawn Game,2
AelmoJUj,True,1496380000000.0,1496380000000.0,40,resign,black,10+0,hasan_al-banna,1423,kondrat70,1610,e4 e5 Nf3 Nc6 Bc4 h6 O-O Nf6 d3 Be7 Nc3 O-O Nd5 d6 Nxe7+ Qxe7 h3 a6 Be3 Be6 Bxe6 Qxe6 c3 d5 Nd2 d4 cxd4 exd4 Bf4 Rac8 Nf3 Nd7 Qe2 f5 Nd2 fxe4 Qxe4 Qxe4 dxe4 Rxf4,C55,Italian Game: Anti-Fried Liver Defense,6
g7Agh37v,True,1496340000000.0,1496340000000.0,42,resign,white,10+0,omnivoid,1463,hasan_al-banna,1432,d3 d5 h4 e5 h5 Nf6 Bg5 Be7 Na3 Nc6 Qc1 Be6 Rb1 Nxh5 Bxe7 Qxe7 Rxh5 Nd4 Rxe5 O-O Nf3 Nf5 g3 Rfe8 Qf4 h6 Nb5 g5 Qd2 g4 Nfd4 Ng7 Qxh6 Qc5 Rg5 Qf8 Nxc7 f6 Ncxe6 Qf7 Rxg7+ Qxg7,A00,Mieses Opening,1
hqtZMahy,True,1496340000000.0,1496340000000.0,50,resign,white,10+0,bip5,1440,hasan_al-banna,1443,d4 d5 c4 Nf6 Nc3 e6 Nf3 Bb4 e3 Ne4 Bd2 Bxc3 Bxc3 Nxc3 bxc3 c5 cxd5 cxd4 cxd4 Qa5+ Qd2 Qxd5 Rc1 O-O Ne5 Nd7 Nxd7 Bxd7 Bc4 Qg5 O-O Rac8 Be2 Rxc1 Rxc1 Bc6 Bf1 f6 Qb4 Rc8 Qd6 Bxg2 Rxc8+ Kf7 Qd7+ Kg6 Qe8+ Kh6 Bxg2 Qb5,E20,Nimzo-Indian Defense: Ragozin Variation,8
IJ50Mc4n,True,1496340000000.0,1496340000000.0,25,mate,white,10+0,hasan_al-banna,1432,kreatonn,1456,e4 e5 Nf3 Nc6 Bc4 Nf6 Ng5 d5 exd5 Nxd5 Nxf7 Kxf7 Qf3+ Ke6 Nc3 Nb4 a3 Nxc2+ Kd1 Nxa1 Bxd5+ Ke7 Qf7+ Kd6 Ne4#,C57,Italian Game: Two Knights Defense |  Fried Liver Attack,11
Z7wymBsC,True,1496340000000.0,1496340000000.0,88,mate,black,10+0,hasan_al-banna,1437,darkclassic,1635,e4 e6 d4 b6 Nc3 Bb7 Bd3 h6 Nf3 d6 Be3 Be7 O-O Nf6 a3 Nbd7 e5 Nd5 Nxd5 Bxd5 exd6 cxd6 Ne5 dxe5 dxe5 Nxe5 Bb5+ Bc6 Qxd8+ Rxd8 Bf4 Bxb5 Bxe5 Bxf1 Rxf1 f6 Bc3 e5 f3 O-O g4 Bc5+ Kg2 Bd4 Bb4 Rfe8 c3 Bc5 Bxc5 bxc5 b4 cxb4 axb4 Rd2+ Kg3 Rc2 Ra1 Re7 Ra3 Rc7 Kh4 R2xc3 Rxc3 Rxc3 Kh5 Rb3 g5 fxg5 h4 gxh4 Kxh4 Rxb4+ Kh5 a5 Kg6 a4 f4 exf4 Kf5 f3 Kg6 f2 Kh5 f1=Q Kg6 Qf6+ Kh5 Qg5#,C00,French Defense: Normal Variation,3
GoVvqPqd,True,1496340000000.0,1496340000000.0,62,resign,black,10+0,marosv2,1412,hasan_al-banna,1427,e4 c5 Qf3 d6 Bc4 Nf6 Nh3 Nxe4 Qxf7+ Kd7 Qe6+ Kc7 Qxe4 d5 Bxd5 e6 Bxe6 Bd6 Bxc8 Re8 Qxe8 Qxe8+ Kd1 Qxc8 Re1 Bxh2 Re7+ Nd7 Rxg7 Qh8 Re7 Kc6 d3 Ne5 Nc3 Bg1 Bf4 Ng4 f3 Nf2+ Nxf2 Bxf2 Re6+ Kd7 Rd6+ Ke8 Re6+ Kf8 Bd6+ Kf7 Re2 Qd4 Re7+ Kg6 Rxb7 Bg3 Rb5 Bxd6 Na4 Qg1+ Kd2 Qxa1,B20,Sicilian Defense,2
AmM5xc4C,True,1496340000000.0,1496340000000.0,48,mate,black,10+0,amanitacaesarea,1443,hasan_al-banna,1415,e4 c5 Nf3 d6 d4 cxd4 Nxd4 g6 Bc4 Bg7 O-O Nf6 Re1 Nxe4 Rxe4 d5 Bb5+ Nc6 Bxc6+ bxc6 Rf4 e5 Nxc6 Qc7 Qxd5 exf4 c3 O-O Na3 Bb7 Nb5 Qxc6 Qxc6 Bxc6 Nc7 Rac8 Bxf4 Rfd8 Na6 Rd3 Nc5 Rd5 b4 Rcd8 g3 Rd1+ Rxd1 Rxd1#,B34,Sicilian Defense: Accelerated Dragon,8
1IhaPtg1,True,1496340000000.0,1496340000000.0,30,resign,black,10+0,discipleofjesus,1418,hasan_al-banna,1404,e4 e5 Nf3 Nc6 h3 Bc5 c3 d6 a3 Be6 b4 Bb6 Bb2 a6 d3 Nf6 Nbd2 O-O Nc4 d5 Ncxe5 Nxe5 Nxe5 dxe4 dxe4 Qxd1+ Rxd1 Nxe4 c4 Nxf2,C44,King's Knight Opening: Normal Variation,4
ai5MT9vd,True,1496230000000.0,1496230000000.0,110,mate,black,10+0,josebas94,1261,hasan_al-banna,1397,d4 d5 c3 c5 e3 Nc6 dxc5 e5 Qa4 Bd7 Bb5 Bxc5 Qb3 Qg5 g3 a6 Be2 Nf6 Qxb7 O-O Nh3 Bxh3 Qxc6 Ba7 Qxa6 Ne4 Nd2 Nxf2 Nf3 Qxe3 Bxe3 Bxe3 Qb5 Bg4 O-O Nh3+ Kh1 e4 Nh4 Rab8 Qxd5 Bxe2 Rfe1 Rxb2 a4 Nf2+ Kg2 Ng4 a5 Bc4+ Re2 Rxe2+ Kf1 Bxd5 Kxe2 Bg5 a6 Bxh4 gxh4 Nxh2 Ke3 Ng4+ Kd4 Be6 a7 Rd8+ Kc5 Ra8 Kc6 Bc8 Kc7 f5 c4 f4 Rg1 Ne3 Re1 Ng2 Rg1 Nxh4 Rg4 Bxg4 Kb6 Rxa7 Kxa7 f3 c5 f2 c6 f1=Q c7 e3 c8=Q+ Bxc8 Kb8 e2 Kxc8 e1=Q Kc7 Qf7+ Kd6 Qff2 Kc6 Qfd2 Kc5 Qec1+ Kb6 Qdb2+ Ka5 Qca1#,D00,Queen's Pawn Game,2
MWlrqKoX,True,1496230000000.0,1496230000000.0,60,mate,black,10+0,hasan_al-banna,1406,ignar74,1458,e4 c5 Nf3 a6 d4 e6 Nc3 b5 dxc5 Bxc5 Be3 Bb4 Bd2 Nc6 Bd3 e5 O-O Nf6 Nd5 Bxd2 Qxd2 Nxd5 exd5 d6 dxc6 O-O Qc3 e4 Bxe4 d5 Bd3 Qd6 Ng5 g6 Qd4 Qxc6 Qh4 h5 b3 Qf6 Nf3 Qd6 Qg3 Qxg3 hxg3 Bg4 Ne5 Rae8 Nd7 Bxd7 f4 Re3 Rf3 d4 Kf2 Rfe8 Rxe3 dxe3+ Kf3 Bg4#,B40,Sicilian Defense: Drazic Variation,6
O3LSjqLN,True,1496230000000.0,1496230000000.0,39,mate,white,10+0,karasuki,1349,hasan_al-banna,1419,e4 e5 Nf3 Nc6 Nc3 Nf6 Bc4 Nxe4 Nxe4 d5 Bxd5 Qxd5 Nc3 Qe6 O-O Qg6 Re1 Bh3 g3 Bg4 Nxe5 Nxe5 Rxe5+ Be7 Qe1 Qf6 b3 O-O Bb2 Rae8 Nd5 Qd6 Nxe7+ Rxe7 Rxe7 Qc6 Qe5 Bh3 Qxg7#,C46,Four Knights Game: Italian Variation,7
QPrtaCXt,True,1496230000000.0,1496230000000.0,63,resign,white,10+0,hasan_al-banna,1412,warusso2017,1305,d4 d5 c4 dxc4 e4 c5 Nf3 cxd4 Nxd4 b6 Bxc4 Bb7 Nc3 e5 Nf3 Qxd1+ Nxd1 f6 Nc3 Bb4 Bd2 Bxc3 Bxc3 Nd7 O-O Bxe4 Rfd1 Bxf3 gxf3 Rd8 Bb5 Ne7 Rd2 O-O Bxd7 Nf5 Bxf5 Rxd2 Bxd2 Rd8 Be3 g6 Be6+ Kg7 Rc1 g5 Rc7+ Kg6 Rxa7 Rd1+ Kg2 Rd6 Bb3 f5 Rb7 f4 Rxb6 Rf6 Rxf6+ Kxf6 Bb6 h5 a4,D20,Queen's Gambit Accepted: Central Variation |  Rubinstein Defense,6
d1B9WunE,True,1496230000000.0,1496230000000.0,40,mate,black,10+0,hasan_al-banna,1424,qwf,1356,d4 d5 c4 dxc4 e4 b5 Nc3 b4 Nd5 c6 Nxb4 e5 Qa4 Bd7 Bxc4 c5 Qb3 cxb4 Bxf7+ Ke7 Bg5+ Nf6 Qxb4+ Kxf7 Qc4+ Be6 Qb5 a6 Qb7+ Nbd7 dxe5 Qa5+ Ke2 Nxe4 Qxa8 Nxg5 f4 Bc4+ Ke3 Bc5#,D20,Queen's Gambit Accepted: Central Variation |  Greco Variation,6
E5cDonjn,True,1496230000000.0,1496230000000.0,15,resign,white,10+0,hasan_al-banna,1413,hawkwild,1434,d4 e6 c4 Qf6 Nc3 Bb4 Bd2 Bxc3 Bxc3 Nh6 e4 Ng4 Qxg4 h5 Qd1,A40,Horwitz Defense,2
nNJzzLn6,True,1496230000000.0,1496230000000.0,47,mate,white,10+0,hasan_al-banna,1408,teman02,1184,e4 d6 d4 Nf6 Nc3 g6 Nf3 Nh5 Be2 c5 dxc5 Bg7 cxd6 exd6 Nb5 Bg4 Nxd6+ Ke7 Bg5+ f6 Be3 f5 Bg5+ Bf6 Bxf6+ Kxf6 e5+ Ke6 Bc4+ Ke7 Qd2 Nc6 O-O-O Nxe5 Qg5+ Kd7 Nxb7+ Kc7 Nxd8 Bxf3 Qe7+ Kb6 Rd6+ Ka5 Qxe5+ Kb4 Qb5#,B07,Pirc Defense: Classical Variation #2,7
piELNv7f,True,1496230000000.0,1496230000000.0,44,resign,white,10+0,lulucholista,1500,hasan_al-banna,1414,e4 e5 b4 Bxb4 c3 Bf8 Nf3 Nc6 g4 d6 g5 Bg4 Bg2 Bxf3 Bxf3 Qxg5 d3 O-O-O Bxg5 Re8 Bg4+ Kb8 Na3 Nf6 Bf5 h6 Bxf6 gxf6 Nc4 Ne7 Bg4 Ng6 Bf5 Nh4 Bg4 Rg8 Ne3 h5 Bxh5 Bh6 Bxf7 Nf3+ Qxf3 Bxe3,C20,King's Pawn Game,2
fkCxxxOw,True,1496230000000.0,1496230000000.0,86,resign,black,10+0,kayhan34,1343,hasan_al-banna,1406,e4 e6 f3 Nf6 e5 Ne4 fxe4 Qh4+ g3 Qxe4+ Qe2 Qxh1 Qg2 Qxg2 Bxg2 Bc5 c3 Bxg1 Na3 Bxh2 Nc4 Bxg3+ Kd1 d5 Na5 Bxe5 d4 Bd6 Nb3 O-O Nd2 e5 Bxd5 exd4 cxd4 Bg4+ Ke1 Re8+ Kf2 c6 Bg2 Nd7 Nc4 Bc7 Bg5 Nf6 d5 Ne4+ Bxe4 Rxe4 Nd2 Re6 dxe6 fxe6 Rf1 Rf8+ Kg1 Rxf1+ Kxf1 Be5 b3 Bf5 Nc4 Bd3+ Kg2 Bf6 Be3 Bxc4 bxc4 Bb2 Bxa7 g6 a4 Bc3 Kf3 Kf7 Ke3 h5 Kd3 h4 Bc5 Bf6 Bd6 g5 a5 g4,C00,French Defense #2,2
VGVcxQ0e,True,1496350000000.0,1496350000000.0,73,resign,white,10+0,skulll1,1697,linconnu,1592,e4 a6 d4 b5 f4 Bb7 Bd3 e6 Ne2 c5 c3 c4 Bc2 Nf6 e5 Ng4 O-O Qh4 h3 Be7 hxg4 Qxg4 Rf2 Bh4 g3 Qh3 Rh2 Qg4 Rxh4 Qf3 Rh2 h5 Qf1 Qg4 Qh3 Qf3 Qg2 Qxg2+ Rxg2 Bxg2 Kxg2 O-O Nd2 f6 Ne4 fxe5 dxe5 Nc6 Be3 Ne7 Rh1 g6 Nf6+ Kg7 Nxd7 Rfd8 Nb6 Rab8 Nd4 Nd5 Nxe6+ Kh7 Bd4 Nxb6 Nxd8 Rxd8 Rxh5+ Kg8 Rg5 Nd7 Rxg6+ Kf7 e6+,B00,St. George Defense,2
n983jruV,True,1496350000000.0,1496350000000.0,80,mate,black,10+0,skulll1,1693,massaggro,2287,e4 Nf6 Nf3 Nxe4 Be2 d5 O-O c5 d4 cxd4 Qxd4 Nc6 Bb5 a6 Bxc6+ bxc6 Ne5 Bb7 f3 Nf6 c4 e6 cxd5 exd5 Re1 Be7 Bg5 O-O Nc3 h6 Be3 c5 Qa4 d4 Rad1 Qc8 Bxh6 gxh6 Nb1 Re8 Qc2 Bd6 Ng6 Qc7 h4 fxg6 Qxg6+ Qg7 Rxe8+ Rxe8 Qxg7+ Kxg7 Nd2 Re2 Nc4 Bg3 a4 Bd5 Nd2 c4 Kf1 Re7 Ne4 Nxe4 fxe4 Bxe4 h5 Bd3+ Kg1 c3 bxc3 dxc3 a5 c2 Ra1 Be2 Rc1 Bd1 Rxd1 cxd1=R#,B02,Alekhine Defense: John Tracy Gambit,3
elfEa1pg,True,1496350000000.0,1496350000000.0,117,draw,draw,10+0,linconnu,1588,skulll1,1696,a3 c6 b4 b5 Bb2 a5 e3 axb4 axb4 Rxa1 Bxa1 Na6 c3 Nf6 Nf3 e6 c4 Bxb4 cxb5 cxb5 Bxb5 O-O Qa4 Qa5 Qxa5 Bxa5 O-O Ne4 Ng5 Nxd2 Nxd2 Bxd2 Bd3 g6 Rd1 Bb4 Bf6 Nc5 Bb5 h6 Nf3 Ne4 Bb2 d5 Ne5 Nc3 Bxc3 Bxc3 Nc6 Kg7 Rc1 Bf6 h3 Bd7 g4 Rc8 f4 Bb2 Rc2 Bxc6 Bxc6 d4 exd4 Bxd4+ Kg2 e5 fxe5 Bxe5 Rc5 Bf6 Kf3 g5 Ke4 Rd8 Kf3 Rd3+ Kg2 Rd2+ Kf3 Rf2+ Kxf2 Bd4+ Kf3 Bxc5 Ke4 Bf2 Kf5 Bg3 Be4 Bf4 Bd3 f6 Bc4 Be5 Bd3 h5 gxh5 Kh6 Be2 Bd4 Bf3 Bc3 Be2 Ba1 Bf3 Be5 Bg4 Bc3 Bf3 Be5 Bg4 Bd4 Bd1 Bc3 Be2 Be5 Bg4,A00,Anderssen Opening,1
wYgnrSis,True,1496350000000.0,1496350000000.0,41,mate,white,10+0,otek7272,1596,skulll1,1711,e4 e5 Bc4 d6 Nc3 Be6 Nd5 c6 Ne3 Nf6 d3 Be7 Bxe6 fxe6 Nf3 Nbd7 Ng5 Nc5 b4 h6 bxc5 hxg5 Qg4 Qa5+ Bd2 Qxc5 Qxe6 Rf8 Nf5 Rf7 O-O Qxc2 Be3 Qxd3 Rab1 b6 Rfd1 Qxe4 Nxd6+ Kf8 Qxf7#,C23,Bishop's Opening,3
uRK8k2G7,True,1496350000000.0,1496350000000.0,94,mate,black,10+0,skulll1,1721,bchessl,1754,e4 c5 Nf3 d6 d3 Nf6 Bg5 e6 Nc3 Be7 Be2 O-O O-O Nc6 e5 Nxe5 Nxe5 dxe5 Bxf6 Bxf6 Ne4 Be7 Qc1 f5 Ng3 Bg5 f4 exf4 Rxf4 Qc7 Nh5 g6 g3 gxh5 Bxh5 Bxf4 gxf4 Qg7+ Kh1 Kh8 Qe3 Rg8 Bf3 Bd7 Qxc5 Bc6 Bxc6 bxc6 Qf2 Qxb2 Rf1 Rg6 Qc5 Rag8 d4 Qb5 c4 Qxc5 dxc5 h5 a4 h4 a5 h3 a6 Rg4 Rd1 Rxf4 Rb1 Rxc4 Rd1 Rb4 Re1 Kh7 Rd1 Kh6 Ra1 Kh5 Rf1 f4 Re1 Kh4 Rf1 f3 Re1 Rgg4 Rd1 f2 Rf1 Rgf4 Rg1 fxg1=R+ Kxg1 Rb1#,B50,Sicilian Defense,4
zXpCZ0kC,True,1496180000000.0,1496180000000.0,63,resign,white,10+0,skulll1,1721,aryrasyid,1857,e4 e5 Nf3 f5 exf5 Nf6 Nxe5 Bc5 d4 Bb6 Bc4 d5 Qe2 O-O Bd3 Bxd4 Nf3 Re8 Be3 Bb6 O-O d4 Ng5 h6 Bc4+ Be6 Nxe6 Rxe6 fxe6 Kh8 Rd1 Nc6 c3 Ne5 Bxd4 Nxc4 Qxc4 c5 e7 Qd7 Bxf6 Qxd1+ Qf1 Qxf1+ Kxf1 gxf6 Na3 Re8 Re1 Kg7 Nc4 Bc7 Ne3 Bxh2 g3 Kg6 Nd5 h5 Kg2 Bxg3 fxg3 f5 Nc7,C40,Latvian Gambit Accepted,5
CF4kOTbS,True,1496180000000.0,1496180000000.0,80,outoftime,black,10+0,skulll1,1735,1111112222,1649,e4 e5 Nf3 Qf6 d3 h6 Be2 Ne7 Nc3 c6 d4 d6 Be3 Ng6 dxe5 dxe5 g3 Bb4 Bd2 Bh3 a3 Bxc3 Bxc3 Bg2 Rg1 Bxf3 Bxf3 O-O Qe2 Na6 O-O-O b5 Bh5 Nc5 Bb4 Nxe4 Qxe4 Qg5+ f4 Qxh5 Bxf8 Rxf8 f5 Ne7 g4 Qxh2 g5 g6 gxh6 Qxh6+ Kb1 Nxf5 Qxf5 Re8 Rdf1 Qg7 Qxe5 Rxe5 Rd1 Re8 Rd7 a5 Rd6 c5 Rb6 b4 axb4 cxb4 Rb5 Qd4 Rgg5 Re1+ Ka2 a4 Rgc5 b3+ cxb3 axb3+ Rxb3 Qxc5,C40,King's Pawn Game: McConnell Defense,4
CWJ3iI2E,True,1496180000000.0,1496180000000.0,67,draw,draw,10+0,skulll1,1731,society,1879,e4 e5 Nf3 Nc6 Bb5 Nf6 O-O Nxe4 Bxc6 dxc6 Nxe5 Nf6 Re1 Be7 d4 O-O Bf4 c5 c3 cxd4 cxd4 Bd6 Nd3 Bxf4 Nxf4 Bf5 Nc3 c6 d5 cxd5 Ncxd5 Nxd5 Qxd5 Qxd5 Nxd5 Be6 Nc7 Rac8 Nxe6 fxe6 Rxe6 Rc2 f3 Rxb2 Re7 Rf7 Re8+ Rf8 Re7 a5 a4 h6 Rc1 b5 Rcc7 Rd8 Rxg7+ Kf8 Rcf7+ Ke8 Re7+ Kf8 Ref7+ Ke8 Re7+ Kf8 Ref7+,C67,Ruy Lopez: Berlin Defense |  Rio Gambit Accepted,8
jl43hHmo,True,1495830000000.0,1495830000000.0,116,outoftime,black,10+0,kombat_ace,1643,skulll1,1722,e4 e5 Nf3 Nf6 Nc3 Bb4 d3 Bxc3+ bxc3 d5 exd5 Qd7 c4 e4 Ne5 Qf5 Bb2 exd3 Bxd3 Qg5 O-O O-O f4 Qh4 g3 Qh3 Be2 h5 Rf3 Bg4 Rf2 Bxe2 Qxe2 Ng4 Nxg4 Qxg4 Qxg4 hxg4 Re1 Na6 Re5 Nc5 Ba3 b6 Rfe2 f6 Re7 Rf7 Re8+ Rxe8 Rxe8+ Kh7 Bxc5 bxc5 Ra8 c6 dxc6 Rc7 Kf2 Kg6 a3 Kf5 Ke3 g5 fxg5 Kxg5 Rg8+ Kf5 Ra8 Rxc6 Rxa7 Re6+ Kf2 Re4 Ra5 Rxc4 Ke3 Rxc2 Kd3 Rxh2 Rxc5+ Kg6 Rc2 Rh3 Rg2 Kf5 Rf2+ Ke5 Re2+ Kd5 Re3 Kc5 Ke4 Rh5 Kf4 Rg5 Re6 Rg6 Re1 Kb5 Ra1 Ka4 Ra2 Rg5 Ra1 Rg7 Kf5 Rg5+ Kxf6 Rc5 Kg6 Rc3 Rg1 Rc5 Kh6 Kxa3,C42,Russian Game: Three Knights Game,5
iFhCGwBS,True,1495530000000.0,1495530000000.0,130,mate,black,10+0,herecomesdaddy,1228,skulll1,1732,e4 e5 Qh5 d6 Bc4 g6 Qf3 Be6 Bxe6 fxe6 d3 Nc6 Nc3 Bg7 Nge2 Nf6 O-O O-O b3 Nd4 Nxd4 exd4 Nb5 a6 Nxd4 Nd5 Nxe6 Rxf3 Nxd8 Rf8 Ne6 Bxa1 Nxf8 Rxf8 Bh6 Bg7 Bxg7 Kxg7 exd5 Rf5 c4 Re5 f4 Re3 Rd1 Re2 Kf1 Rxa2 b4 Rb2 Re1 Kf7 c5 Rxb4 cxd6 cxd6 g4 Rxf4+ Kg2 Rxg4+ Kf3 Rd4 Ke3 Rxd5 Rb1 b5 Ra1 b4 Rxa6 Rb5 Rxd6 b3 Rc6 b2 d4 b1=Q d5 Rb3+ Kd4 Qd3+ Ke5 Qf5+ Kd6 Qf6+ Kc5 Qxc6+ Kxc6 h5 d6 h4 d7 Rd3 Kc7 g5 d8=Q Rxd8 Kxd8 g4 Kd7 g3 hxg3 hxg3 Kd6 g2 Ke5 g1=Q Kd5 Qe1 Kd4 Ke6 Kc4 Qd2 Kc5 Kd7 Kc4 Kc6 Kb3 Kb5 Ka3 Qc3+ Ka2 Kb4 Kb1 Kc4 Ka2 Qb4 Ka1 Kc3 Ka2 Qb2#,C20,King's Pawn Game: Wayward Queen Attack,3
Se7cwxmA,True,1495440000000.0,1495440000000.0,73,resign,white,10+0,skulll1,1716,dominikcubric,1856,e4 e5 Nf3 Nc6 Bb5 Nf6 O-O d6 d4 exd4 Nxd4 Bd7 Nxc6 Bxc6 Bxc6+ bxc6 Re1 Nd7 Bf4 Be7 e5 dxe5 Bxe5 Nxe5 Qxd8+ Rxd8 Nc3 Ng6 Ne4 O-O a3 f5 Ng3 Bc5 b4 Bb6 c4 c5 b5 Rd4 Rac1 Rfd8 Nxf5 Rd2 h4 Ra2 h5 Nf4 Ne7+ Kf7 Nc6 Rdd2 Re7+ Kf6 g3 Nh3+ Kg2 Nxf2 Rf1 Kg5 Rxg7+ Kh6 Rg8 Ne4+ Kf3 Rf2+ Rxf2 Nxf2 g4 Nd1 Ne5 Rxa3+ Kf4,C66,Ruy Lopez: Berlin Defense |  Improved Steinitz Defense,8
cguKe0JQ,True,1495440000000.0,1495440000000.0,93,resign,white,10+0,skulll1,1710,narcad,1712,e4 c5 Nf3 d6 d4 cxd4 Nxd4 Nf6 Nc3 a6 Bg5 e6 Bd3 Nc6 Nxc6 bxc6 O-O Bb7 Re1 Be7 f4 h6 Bxf6 Bxf6 e5 Be7 Kh1 d5 Ne2 c5 c4 d4 Ng3 Bh4 Qg4 Qc7 Qxh4 Qc6 Be4 Qb6 b3 Bxe4 Nxe4 Qc6 Qg4 Ke7 Qxg7 Rag8 Qf6+ Kd7 Qxf7+ Kc8 Nd6+ Kb8 Ne4 Rf8 Qe7 Rxf4 Qd6+ Kb7 Nxc5+ Kb6 Qxc6+ Kxc6 Nxe6 Rg4 h3 Rg3 Kh2 Rhg8 Nf4 d3 Rad1 Kc5 Rxd3 Rxd3 Nxd3+ Kd4 Nb4 Ra8 e6 Kc5 Nd5 Kd6 e7 Re8 Nf6 Rxe7 Rxe7 Kxe7 Ng8+ Kd6 Nxh6,B95,Sicilian Defense: Najdorf Variation,12
CZ5SVUxo,True,1495440000000.0,1495440000000.0,94,outoftime,black,10+0,slavik-1991,1828,skulll1,1694,d4 c6 c4 d5 e3 Nf6 Nc3 g6 Nf3 Bg7 h3 Na6 a3 Nc7 Bd3 dxc4 Bxc4 Be6 Bd3 Ncd5 O-O O-O Ng5 Nxc3 bxc3 Bd7 e4 Qc8 e5 Nd5 c4 Nb6 Qf3 Bf5 Ne4 Bxe4 Qxe4 Qf5 Qe2 Qd7 Be3 e6 Rad1 Rad8 f4 Qe7 c5 Nd5 Bd2 f5 exf6 Qxf6 Qe5 Qxe5 fxe5 Rxf1+ Rxf1 Rf8 Be4 Rxf1+ Kxf1 Kf7 Ke2 h6 Kf3 g5 g3 Bf8 Ba5 Be7 Bxd5 exd5 Bc7 Ke6 Kg4 Bf8 Kh5 Kf7 a4 Kg7 a5 Be7 Bd6 Bd8 e6 Bxa5 Be5+ Kf8 Kxh6 Ke7 Kxg5 Bd2+ Kg6 Kxe6,D10,Slav Defense,4
Wkqzanur,True,1495440000000.0,1495440000000.0,33,resign,white,10+0,skulll1,1685,igorilla,1609,e4 c6 Nf3 d5 exd5 cxd5 Bb5+ Nc6 Ne5 Bd7 d4 Qa5+ Nc3 a6 Bxc6 Bxc6 Qf3 f6 Qh5+ g6 Nxg6 O-O-O Nxh8 Bg7 Nf7 Be8 Qg4+ Bd7 Qe2 Rf8 Qh5 Be6 Qxh7,B10,Caro-Kann Defense,2
PpUe923V,False,1500480000000.0,1500480000000.0,47,mate,white,10+8,ranger440,1472,homersimpson1,1445,d4 d5 Bf4 Nf6 Nf3 e6 e3 Bd6 Bd3 Bxf4 exf4 Nc6 c3 O-O h4 g6 Nbd2 b6 Qc2 Nb8 Ne5 Ba6 Bxa6 Nxa6 Nc6 Qd6 Ne5 h5 Ndf3 c5 O-O-O c4 Rdg1 Ne4 g4 hxg4 Rxg4 Nf6 Rg5 Nh7 Rg3 b5 h5 f6 Qxg6+ Kh8 Qg7#,D02,Queen's Pawn Game: London System,5
Y4vnnJda,False,1500480000000.0,1500480000000.0,23,mate,white,20+5,ranger440,1472,mehdi1368,1500,d4 Nf6 Bf4 d5 Nf3 Bf5 e3 e6 Bd3 Ne4 Bxe4 Bxe4 Nbd2 f5 Ne5 c5 Qh5+ Ke7 Qf7+ Kd6 Qxb7 Bxg2 Nec4#,D02,Queen's Pawn Game: London System,5
0TxHw0WP,False,1500470000000.0,1500470000000.0,84,resign,white,15+15,ranger440,1472,amigo92,1218,d4 d5 Bf4 e6 Nf3 Nc6 e3 Bd6 Bxd6 Qd7 Bd3 Qxd6 c3 Nf6 Nbd2 a6 Qc2 b5 h4 h6 Nb3 b4 cxb4 Nxb4 Qd2 a5 Rc1 Ba6 Bxa6 Rxa6 a3 Na2 Rc5 Ne4 Qd3 Rb6 Rxa5 Kd7 Nc5+ Ke7 Nxe4 dxe4 Qxe4 Rhb8 Ne5 Rxb2 Nc4 Rb1+ Ke2 Nc3+ Kd3 Nxe4 Nxd6 Rxh1 Nxe4 Rb3+ Ke2 Rb2+ Kf3 Rxh4 Ra7 Rc2 a4 f5 Nc5 Kd6 a5 g5 a6 g4+ Kg3 Rh1 Ra8 e5 a7 Ra1 Rd8+ Kc6 a8=Q+ Kb5 Qxa1 f4+ exf4 Rxc5,D00,Queen's Pawn Game: Mason Attack,3
Igw3bRib,False,1500470000000.0,1500470000000.0,6,resign,white,180+0,victor946c,1161,ranger440,1472,d4 d6 c4 Bg4 h3 Bxe2,A41,Old Indian Defense,3
iSLobDeu,True,1500470000000.0,1500470000000.0,88,mate,black,20+2,ranger440,1493,ebrahimzare,1315,d4 f5 Bf4 Nf6 Nf3 e6 e3 c6 Bd3 Qa5+ c3 b6 Nbd2 b5 Ne5 d6 Nef3 c5 Nh4 cxd4 Qf3 Nd5 exd4 Bb7 Nb3 Qb6 Qh5+ g6 Nxg6 Rg8 Ne5+ Kd8 Nf7+ Kc8 Rc1 Nxf4 Qd1 Bxg2 Rg1 Bf3 Qxf3 Rxg1+ Kd2 Rxc1 Kxc1 Bh6 Qxa8 Nxd3+ Kc2 Nb4+ cxb4 Qc7+ Kd3 Qxf7 Na5 e5 Nc6 Qc7 d5 e4+ Ke2 Qb7 Nxa7+ Kc7 Nxb5+ Qxb5+ Ke1 Qxb4+ Kf1 Qc4+ Kg2 f4 Qa7+ Kc8 Qxh7 f3+ Kg3 Bd2 Qg8+ Kb7 Qf7+ Ka8 Qe6 Qf1 h3 Qg2+ Kh4 Qg5#,A80,Dutch Defense,2
9XVsYJiz,False,1498250000000.0,1498250000000.0,35,mate,white,20+0,ranger440,1493,sourindu,1500,d4 d5 Bf4 Nc6 Nf3 f6 h4 e5 dxe5 Bg4 Nbd2 Bb4 c3 Bxf3 Nxf3 Bc5 e3 Qe7 Bd3 Nxe5 Nxe5 fxe5 Qh5+ Kd7 Bxe5 Nf6 Qf5+ Kc6 Bxf6 gxf6 c4 Bxe3 Qxd5+ Kb6 Qb5#,D00,Queen's Pawn Game: Mason Attack,3
e3WOcIgQ,False,1498250000000.0,1498250000000.0,78,mate,black,12+0,akaish,1463,ranger440,1493,e4 Nc6 Nf3 d6 d4 d5 e5 Bf5 c3 e6 b4 a6 Ba3 f6 b5 Bxa3 Nxa3 axb5 Nxb5 fxe5 Be2 exd4 Nfxd4 Nxd4 Qxd4 Nf6 O-O O-O a4 c6 Na3 Ne4 f3 Nd6 Rfb1 Qg5 h3 Bxh3 Bf1 Bf5 Re1 Rae8 Qe5 Nf7 Qc7 Rb8 Rab1 Bxb1 Nxb1 Rfc8 Qh2 b5 Rxe6 Qf5 Re1 bxa4 Ba6 Rxb1 Rxb1 Qxb1+ Kf2 Qb6+ Kg3 Qxa6 Kh3 Ng5+ Kg4 h6 f4 Qe2+ Kf5 Rf8+ Kg6 Qe4+ f5 Qxf5+ Kh5 Nf3#,B00,Nimzowitsch Defense: Williams Variation,4
