id,rated,created_at,last_move_at,turns,victory_status,winner,increment_code,white_id,white_rating,black_id,black_rating,moves,opening_eco,opening_name,opening_ply
JHs2yQVf,True,1502990000000.0,1502990000000.0,121,mate,white,5+5,fischerdipper,1693,ffuentes90,1666,e4 c5 Nf3 d6 d4 cxd4 Qxd4 Nc6 Bb5 Bd7 Qd3 g6 Nc3 Bg7 Be3 Nf6 O-O O-O Qd2 a6 Ba4 b5 Bb3 Ng4 Bd4 Nxd4 Nxd4 Qb6 Rad1 Ne5 Nd5 Qc5 Nxe7+ Kh8 f4 Nc6 Nxc6 Bxc6 e5 dxe5 fxe5 Bxe5 Bxf7 Bxg2 Kxg2 Rxf7 Rxf7 Qd5+ Rf3 Rf8 c3 Kg8 Rf1 Bxd4 Qxd4 Qg5+ Kh1 Rxf3 Rxf3 Qc1+ Kg2 Qg5+ Rg3 Qe7 Qd5+ Kf8 Rf3+ Kg7 Qd4+ Kg8 a3 Qe2+ Qf2 Qe4 Kh1 g5 Kg1 Qg4+ Kf1 Qc4+ Qe2 Qc6 Qe7 g4 Qg5+ Kh8 Qf6+ Qxf6 Rxf6 Kg7 Rxa6 h5 Rb6 Kf7 Rxb5 Kg6 a4 h4 a5 g3 hxg3 h3 Kg1 Kf6 a6 Ke6 a7 Kd6 a8=Q Kc7 Qb7+ Kd6 Rd5+ Ke6 Qd7+ Kf6 Rf5+ Kg6 Qf7+ Kh6 Rh5#,B53,Sicilian Defense: Chekhover Variation,7
WOwzREnN,True,1502990000000.0,1502990000000.0,30,resign,black,5+5,ffuentes90,1676,fischerdipper,1680,e4 e6 Nf3 d5 exd5 exd5 d4 Nf6 Be2 Nc6 O-O Be7 c3 O-O h3 Bf5 Bf4 a6 Nbd2 Qd7 a4 Rfe8 a5 Ne4 Qa4 Rac8 Nxe4 dxe4 Ne5 Nxe5,C00,French Defense: Knight Variation,3
vCxVnALT,True,1502900000000.0,1502900000000.0,64,resign,black,10+3,coco31,1142,fischerdipper,1679,e3 d5 d4 e6 Qe2 Nf6 Nc3 Nc6 f3 a6 Bd2 Bd6 e4 dxe4 fxe4 Nxd4 Qe3 Nxc2+ Kf2 Nxe3 Bxe3 Ng4+ Kf3 Nxe3 Kxe3 Qg5+ Kd3 O-O h4 Qf6 Nge2 Rd8 Nd5 exd5 exd5 Qxb2 Rc1 Bf5+ Kc4 Qb5+ Kd4 c5+ Ke3 Qd3+ Kf2 Re8 Ng3 Qd2+ Be2 Bxg3+ Kxg3 Qxe2 Rhe1 Qg4+ Kh2 Be4 Rc2 Qxh4+ Kg1 Qxe1+ Kh2 Bxc2 g3 Re2+,D00,Queen's Pawn Game #2,3
BAKj62Jt,True,1502900000000.0,1502900000000.0,15,mate,white,10+3,fischerdipper,1678,coco31,1148,e4 e5 d4 exd4 c3 dxc3 Bc4 cxb2 Bxb2 Nf6 e5 Nh5 Qxh5 d6 Qxf7#,C21,Danish Gambit Accepted |  Classical Defense,10
IhPROx4l,True,1502900000000.0,1502900000000.0,40,resign,black,10+3,coco31,1154,fischerdipper,1676,d3 c5 Be3 d6 d4 cxd4 Qxd4 Nc6 Qd5 e6 Qb5 Bd7 a4 d5 Ra3 Bxa3 Nxa3 Nf6 b3 O-O c4 Ne5 cxd5 Bxb5 Nxb5 exd5 Bf4 Qa5+ Kd1 a6 e3 Neg4 h3 Nxf2+ Ke2 N6e4 Rh2 Qd2+ Kf3 axb5,A00,Mieses Opening,1
FEAnKMLP,True,1502900000000.0,1502900000000.0,128,draw,draw,10+3,fischerdipper,1686,coco31,1098,e4 h6 Nf3 e6 Nc3 d6 Bc4 Nc6 d4 Nf6 O-O e5 dxe5 dxe5 Qxd8+ Kxd8 a3 Nd4 Nxd4 exd4 Rd1 Bc5 e5 Nd7 e6 fxe6 Nb5 c6 Nd6 Bxd6 Bxe6 Re8 Bh3 Re4 c3 Rh4 cxd4 Nf6 Be3 Bxh3 gxh3 Rxh3 b4 Bxh2+ Kf1 Ng4 Kg2 Rh4 Rh1 Kc7 Bd2 Rf8 f3 Nf6 Rxh2 Rxh2+ Kxh2 b6 Bf4+ Kb7 Be5 a5 bxa5 bxa5 Rb1+ Ka6 Bc7 Nd5 Bd6 Rxf3 Kg2 Rd3 Be5 Rd2+ Kf3 Nc3 Rc1 Nb5 Rxc6+ Kb7 Rc5 Nxa3 Rc7+ Kb6 Rxg7 a4 Rg6+ Kb5 Rxh6 Rd1 Rh5 Rf1+ Ke4 Nc2 d5 a3 d6 Rf7 Kd5 a2 Ke6 Rf8 Bg7+ Kc6 Ke7 Rf4 d7 Rd4 d8=Q Rxd8 Kxd8 Nb4 Rh6+ Kd5 Bf8 a1=Q Bxb4 Qa8+ Kc7 Qa4 Rd6+ Kc4 Rh6 Qxb4 Rh4+ Kb5 Rxb4+ Kxb4,B00,Carr Defense,2
wwF013vq,True,1502900000000.0,1502900000000.0,48,resign,black,10+3,coco31,1102,fischerdipper,1685,b4 e5 a4 d5 Nc3 Bxb4 Ba3 d4 Ne4 Bxa3 Rxa3 Qe7 a5 Qxa3 e3 Qxa5 c3 dxe3 fxe3 Qd5 Nf2 Nf6 e4 Qd6 d4 exd4 Qxd4 Qxd4 cxd4 O-O Bc4 Re8 Ngh3 Nxe4 Nxe4 Rxe4+ Kf2 Bxh3 gxh3 Rxd4 Kf3 Rxc4 Rb1 Nc6 h4 Nd4+ Ke3 Re8+,A00,Polish Opening,1
UVCNEXse,True,1502900000000.0,1502900000000.0,51,mate,white,10+3,fischerdipper,1684,coco31,1107,e4 e6 d4 Nf6 Nc3 Nc6 e5 Ng8 Nf3 d6 exd6 cxd6 Bb5 Bd7 Bf4 Qb6 Be3 f6 d5 Qc7 dxc6 Bxc6 Qe2 a6 Bxc6+ bxc6 O-O-O Rb8 Bf4 e5 Bg3 Rb4 Rhe1 Qa5 Nd4 Rxd4 Rxd4 c5 Ra4 Qb5 Nxb5 axb5 Qxb5+ Kf7 Ra7+ Ne7 Ra8 g5 Qe8+ Kg8 Qxf8#,C01,French Defense: Mediterranean Defense,4
YeWcT5XP,True,1502900000000.0,1502900000000.0,71,resign,black,5+5,golden06,1493,fischerdipper,1678,e4 e6 Bc4 d5 exd5 exd5 Bb3 c5 Ba4+ Nc6 d3 Nf6 Bg5 Be7 Nc3 d4 Ne4 Nxe4 Bxe7 Qxe7 dxe4 Qxe4+ Kf1 O-O Nf3 Qg6 Bxc6 Qxc6 Qd2 Qb5+ Qd3 Qxb2 Re1 Qxa2 Ng5 g6 Qg3 Qxc2 Qh4 h5 g3 b5 Qe4 Qxe4 Nxe4 Bb7 Rg1 Bxe4 Rxe4 Rfe8 Rf4 a5 Kg2 b4 Rc1 Rec8 Rf6 a4 Rb6 b3 Rb5 c4 Rb4 c3 Rd1 c2 Rc1 d3 Rd4 b2 Re1,C00,French Defense #2,2
mOQE6k1N,True,1502890000000.0,1502890000000.0,60,resign,white,5+5,silviumd,1525,fischerdipper,1693,d4 d5 Nf3 c6 Bf4 Nf6 c3 Bf5 e3 e6 Nbd2 Nbd7 h4 Be7 h5 h6 Be2 O-O Nh4 Bh7 g4 Rc8 g5 hxg5 Bxg5 Qb6 b3 Kh8 h6 gxh6 Bxh6 Rg8 Qb1 c5 Qb2 cxd4 exd4 e5 dxe5 Nxe5 O-O-O d4 c4 d3 Bf3 Nxf3 Nhxf3 Qa5 Ne4 Ba3 Bd2 Bxb2+ Kxb2 Qd8 Bc3 Rg7 Nxf6 Qxf6 Bxf6 Rg8,D02,Queen's Pawn Game: Zukertort Variation,3
nIQ2d4S6,True,1502820000000.0,1502820000000.0,58,mate,black,5+5,spinola01,1709,fischerdipper,1681,d4 e6 Bf4 d6 Nf3 c6 e3 Nf6 Nbd2 Nbd7 c3 Be7 Bd3 O-O O-O Qc7 Qc2 e5 dxe5 dxe5 Nxe5 Nxe5 Bxe5 Bd6 Bxd6 Qxd6 Nf3 Bg4 Rad1 Qc7 h3 Bh5 g4 Bxg4 hxg4 Nxg4 Bxh7+ Kh8 Bf5 Nh6 Bh3 Rae8 Kg2 c5 Rh1 Qc6 Qe2 g5 Bg4 Re4 Rxh6+ Qxh6 Rh1 Rxg4+ Kf1 Qxh1+ Ng1 Rxg1#,A40,Horwitz Defense,2
PRsV872Z,True,1502810000000.0,1502820000000.0,60,resign,black,5+5,fischerdipper,1692,spinola01,1699,f4 d5 Nf3 c5 d4 cxd4 Qxd4 Nc6 Qc3 Nf6 a3 Ne4 Qe3 e6 Nc3 Bc5 Qd3 Nf2 Qb5 Bb6 Rg1 Ng4 Rh1 O-O h3 Nf6 e3 a6 Qd3 Bd7 Bd2 Rc8 O-O-O Na5 g4 Nc4 g5 Nh5 Ne5 Nxd2 Rxd2 Ng3 Rg1 Nf5 e4 dxe4 Qxd7 Qxd7 Nxd7 Be3 Nxf8 Rxf8 Rg2 Bxf4 Bc4 Nh4 Rg1 Bxd2+ Kxd2 Nf3+,A03,Bird Opening: Dutch Variation,2
TQOTfC0X,True,1502810000000.0,1502810000000.0,40,resign,white,5+5,spinola01,1688,fischerdipper,1704,c4 g6 Nc3 Bg7 Nf3 c5 g3 e6 Bg2 d5 cxd5 exd5 O-O d4 Ne4 Bf5 Nxc5 Ne7 Qa4+ Nbc6 Nxb7 Qc7 Na5 Qxa5 Qxa5 Nxa5 Nxd4 Bxd4 e3 Rd8 exd4 Rxd4 b4 Nc4 a3 Nxd2 Bb2 Rxb4 Bxh8 Rb8,A10,English Opening: Great Snake Variation,2
XA0DImut,True,1502810000000.0,1502810000000.0,29,outoftime,white,5+5,fischerdipper,1699,karabas,1497,c4 c6 e3 e6 d4 a5 Qf3 Qf6 Nc3 e5 Ne4 Qe6 Nh3 f6 Bd3 exd4 exd4 d5 O-O dxe4 Bxe4 Ne7 Bf4 Qxc4 Rac1 Qe6 Rfe1 Qg4 Qb3,A11,English Opening: Caro-Kann Defensive System,2
SBB7hpZn,True,1502810000000.0,1502810000000.0,98,resign,black,5+5,fischerdipper,1703,leviatoff,1943,c4 Nf6 d3 e6 e4 d5 cxd5 exd5 e5 Nfd7 d4 Bb4+ Nc3 O-O a3 Bxc3+ bxc3 c5 Nf3 Nc6 Be2 cxd4 cxd4 Nb6 O-O Bf5 Bd3 Bxd3 Qxd3 h6 Qf5 Qd7 Qxd7 Nxd7 Be3 Na5 Rab1 Nb6 Nd2 Rfc8 Rfc1 Rxc1+ Rxc1 Rc8 Rxc8+ Nxc8 f4 Nb6 Kf2 Nac4 Nxc4 Nxc4 Bc1 Kf8 g4 Ke7 h4 b5 f5 f6 e6 a5 g5 hxg5 hxg5 b4 gxf6+ gxf6 axb4 axb4 Ke2 b3 Kd3 b2 Bxb2 Nxb2+ Kc3 Nd1+ Kb4 Kd6 Kb5 Nf2 Kb6 Ne4 Kb7 Nc3 Kc8 Ne2 Kd8 Nxd4 e7 Nc6+ Ke8 Nxe7 Kf7 Nxf5 Kxf6 Ne3,A15,English Opening: Anglo-Indian Defense,2
9LBbJAy5,True,1502810000000.0,1502810000000.0,71,resign,black,5+5,mb1981,1694,fischerdipper,1692,e4 e6 d4 d5 Nc3 c5 Nf3 cxd4 Nxd4 dxe4 Nxe4 Nc6 Bb5 Bd7 Nxc6 bxc6 Ba4 Qa5+ Nc3 Bb4 Qd4 Nf6 O-O Rd8 Bb3 c5 Qc4 Bxc3 Qxc3 Qc7 Be3 Nd5 Qxc5 Qxc5 Bxc5 Bb5 Rfe1 Rc8 Ba3 Kd7 Rad1 Kc7 Rc1 Nf4 c4 Bc6 Be7 Nd3 Rcd1 Nxe1 Rxe1 Rhe8 Bc5 Kb7 Be3 a5 Bd2 a4 Bc2 Bd7 Bc3 Rxc4 Bxh7 g6 Re3 Rd8 h4 Bc6 Re5 Rxh4 Ra5,C10,French Defense: Marshall Variation,6
jkBe42CV,True,1502810000000.0,1502810000000.0,135,draw,draw,5+5,fischerdipper,1696,elio12,1564,c4 g6 d3 Bg7 Nf3 c5 Nc3 e6 e3 Ne7 Be2 b6 O-O Bb7 Qc2 d5 cxd5 exd5 b3 d4 exd4 Bxd4 Nxd4 cxd4 Nb5 Na6 Nd6+ Qxd6 a4 Rc8 Qd2 O-O Ba3 Qf6 Bg4 Rc3 Rfe1 Re8 Bd7 Rd8 Bxe7 Qd6 Bxd6 Rxd7 Qh6 Rc8 Be5 f6 Bxf6 Rf7 Bxd4 Nb4 Re2 Nxd3 Rd1 Nf4 Re3 Nxg2 Rg3 Nf4 Re1 Ne2+ Kf1 Nxg3+ hxg3 Ba6+ Kg1 Rd8 Ba1 Bb7 Qh4 Rd5 Qe4 Rh5 Qe8+ Rf8 Qe6+ Rf7 Kf1 Ba6+ Kg2 Bb7+ Kf1 Ba6+ Kg2 Bb7+ f3 Bxf3+ Kg1 Rh1+ Kf2 Bd5+ Qxf7+ Kxf7 Rxh1 Bxh1 Ke3 Ke6 Kf4 Bd5 b4 Bb3 a5 bxa5 bxa5 a6 Kg5 Ke7 Kh6 Ke6 Kxh7 Kf5 Kg7 g5 Kf8 g4 Ke7 Ke4 Kd6 Kf3 Be5 Bd1 Kc5 Be2 Kb6 Ke4 Bf4 Kd4 Bb8 Kc3 Bf4 Kb4 Bb8 Ka4 Bf4,A10,English Opening: Great Snake Variation,2
Z9FnkzxR,True,1502810000000.0,1502810000000.0,34,mate,black,5+5,elio12,1572,fischerdipper,1688,e4 e6 d4 d5 exd5 exd5 Nc3 Nf6 Nf3 Nc6 Bg5 Be7 Bb5 O-O Bxc6 bxc6 O-O Bg4 Re1 c5 dxc5 Bxc5 Bxf6 Qxf6 Qxd5 Bxf3 Qxc5 Qg6 g3 Qh6 Re5 Qh3 Rh5 Qg2#,C01,French Defense: Exchange Variation,5
rt1IFgnN,True,1502810000000.0,1502810000000.0,60,mate,black,5+5,waldi65,1392,fischerdipper,1684,d4 d5 e4 e6 Nd2 c5 dxc5 Bxc5 a3 Nf6 Qe2 Qa5 b4 Bxb4 axb4 Qxa1 Qb5+ Nc6 Kd1 O-O e5 Nxe5 Nb3 Qc3 Bd2 Qc7 Nh3 a6 Qe2 Nc4 Qf3 Nxd2 Nxd2 b5 Bd3 e5 Ng5 Bg4 Bxh7+ Kh8 Bf5 Bxf3+ gxf3 e4 f4 Qxf4 h4 Qxf5 Nh3 Ng4 Ng1 Nxf2+ Ke1 e3 Nf1 Qxc2 Nxe3 Nd3+ Kf1 Qf2#,C07,French Defense: Tarrasch Variation |  Open System,6
m6bOuo2a,True,1502730000000.0,1502730000000.0,47,resign,black,5+5,fischerdipper,1707,dinnei,1696,c4 c5 Nc3 e6 d4 Nf6 dxc5 Bxc5 Nf3 O-O Bf4 Nc6 e3 Be7 Bd3 d6 Bc2 e5 Bg5 Bg4 Qd3 g6 Bxf6 Bxf6 a3 Bxf3 gxf3 e4 Nxe4 Bxb2 Rb1 Bxa3 h4 Nb4 Rxb4 Bxb4+ Ke2 Qe7 h5 Rad8 hxg6 fxg6 Qd5+ Qf7 Qb5 Qxf3+ Kf1,A34,English Opening: Symmetrical Variation |  Normal Variation,3
d79KE45O,True,1502730000000.0,1502730000000.0,23,resign,white,5+5,dinnei,1684,fischerdipper,1720,d4 d5 c4 e5 dxe5 d4 Nf3 Nc6 e3 Bb4+ Nbd2 dxe3 fxe3 Bg4 Be2 Bxf3 Bxf3 Nxe5 O-O Nxf3+ Rxf3 Nf6 Qa4+,D08,Queen's Gambit Refused: Albin Countergambit |  Normal Line,7
VzLpYJ1R,True,1502730000000.0,1502730000000.0,78,mate,black,5+5,fischerdipper,1733,dinnei,1672,c4 c5 Nf3 e6 d4 cxd4 Nxd4 Nc6 Nxc6 bxc6 Nc3 Nf6 Bg5 Be7 e3 O-O Bd3 d5 cxd5 cxd5 Bxf6 Bxf6 Bc2 Bb7 O-O e5 Bb1 e4 Qc2 Bxc3 bxc3 f5 Rd1 Qg5 a4 a6 Ba2 Rfd8 c4 Rac8 Rac1 Kh8 Qb3 Ba8 cxd5 Rxc1 Rxc1 Bxd5 Qc2 Bxa2 Qxa2 h6 Qc4 Qg6 g3 h5 Rc2 h4 Qc6 Qg4 Rc1 h3 Qxa6 Qf3 Qf1 Qg4 a5 Ra8 a6 Ra7 Rb1 Rd7 Rb7 Rd1 a7 Rxf1+ Kxf1 Qd1#,A30,English Opening: Symmetrical Variation,2
wLCl9YNn,True,1502730000000.0,1502730000000.0,35,mate,white,5+5,fischerdipper,1721,koljan,1736,c4 Nf6 d4 g6 Nc3 Bg7 Nf3 O-O Bf4 d6 e3 Nh5 Bg5 h6 Bh4 g5 Bg3 Nxg3 hxg3 Nd7 Bd3 c5 Bc2 cxd4 Nxd4 e5 Qd3 Nf6 Nf5 Bxf5 Qxf5 Qc8 Qd3 Ne8 Qh7#,E61,King's Indian Defense,6
RSsb4wYF,True,1502730000000.0,1502730000000.0,53,resign,white,5+5,koljan,1724,fischerdipper,1733,Nf3 d5 g3 Nf6 Bg2 Nc6 Kf1 e6 c3 Bd6 d4 Bd7 Qd3 Qe7 Nbd2 O-O-O c4 dxc4 Nxc4 Bb4 a3 Ba5 Nxa5 Nxa5 Bf4 a6 Qc3 Nc6 Ne5 Nd5 Nxc6 Bxc6 Qc2 Nxf4 Bxc6 Nh3 Bg2 Ng5 h4 Rxd4 hxg5 Qxg5 Rc1 Rd7 Rh4 Rhd8 e3 Qb5+ Kg1 h6 Rb4 Qe5 Bxb7+,A08,King's Indian Attack,4
lm8AKQIn,True,1502730000000.0,1502730000000.0,120,mate,black,5+5,fischerdipper,1746,koljan,1712,c4 c6 d3 e6 Nf3 d5 cxd5 exd5 Nc3 Be6 e3 Nf6 Be2 Nbd7 Nd4 Bc5 Nxe6 fxe6 d4 Bb4 a3 Ba5 b4 Bc7 O-O O-O Qd3 e5 dxe5 Nxe5 Qc2 Bd6 Bb2 Qc7 Na4 Nc4 Bxc4 dxc4 Qxc4+ Kh8 g3 b5 Qc3 bxa4 g4 c5 g5 Bxh2+ Kh1 cxb4 Qxc7 Bxc7 gxf6 gxf6 axb4 Rab8 Bc3 Be5 Bxe5 fxe5 Rxa4 Rb7 Rc1 Rxf2 b5 Rg7 Rc8+ Rg8 Rc7 Rb2 Raxa7 Rd8 Rxh7+ Kg8 Rag7+ Kf8 Rf7+ Ke8 Rh8+ Kxf7 Rxd8 Rxb5 Rd6 Rb3 e4 Rb4 Rd7+ Ke6 Rd8 Rxe4 Kg2 Rf4 Re8+ Kf5 Kg3 Ke4 Kg2 Rf5 Kg3 Ke3 Kg4 Rf4+ Kg3 e4 Ra8 Rf3+ Kg2 Ke2 Ra2+ Ke3 Ra3+ Kf4 Ra4 Rc3 Kf1 Kf3 Ke1 e3 Ra8 Rc1#,A11,English Opening: Caro-Kann Defensive System,2
uiJ5thnm,True,1502730000000.0,1502730000000.0,41,mate,white,5+5,fischerdipper,1741,funracer_at,1496,c4 e6 d3 Bc5 Nf3 a6 Nc3 h6 e3 Nf6 d4 Ba7 Be2 O-O O-O Nc6 e4 b5 d5 exd5 cxd5 Ne5 Nxe5 Bd4 Nf3 Bxc3 bxc3 Nxe4 Qd4 Re8 Bd3 Nf6 c4 c5 Qc3 Bb7 Bb2 bxc4 Bxc4 Ne4 Qxg7#,A13,English Opening: Agincourt Defense,2
GHlw6n8z,True,1504210000000.0,1504220000000.0,42,resign,black,15+15,tensors,1295,blackhat46,1240,d4 d5 c4 Nf6 Nf3 c6 Bg5 e6 e3 Be7 Bd3 Nbd7 O-O O-O Nc3 Ng4 Bxe7 Qxe7 h3 Ngf6 cxd5 cxd5 Qb3 a6 Rac1 b5 a4 b4 Ne2 Bb7 Rc7 Rab8 Ne5 Qd6 Nxd7 Nxd7 Rfc1 a5 Bb5 Nf6 Bc6 Qxc7,D11,Slav Defense: Bonet Gambit,7
yLhzi5Dd,True,1503470000000.0,1503470000000.0,63,resign,white,15+2,fabioamsouza,1430,tensors,1302,d4 d5 Nf3 Nf6 Bg5 Nc6 Bxf6 exf6 Qd3 Bd6 Qe3+ Qe7 Qxe7+ Nxe7 Nc3 O-O Nb5 Bb4+ c3 Ba5 b4 Bb6 a4 a5 e3 axb4 cxb4 Bd7 Nc3 Rfe8 a5 Ba7 Nb5 Bb8 Be2 c6 Nc3 b5 O-O Bd6 Rfb1 Bf5 Rb2 g6 Nh4 Be6 Rba2 Bxb4 Nd1 Ra6 Rb1 Bxa5 Rba1 Rea8 Nf3 Bg4 h3 Bxf3 gxf3 Bc7 Rxa6 Rxa6 Rxa6,D03,Queen's Pawn Game: Torre Attack,5
brPQOL4Y,False,1503360000000.0,1503360000000.0,23,resign,black,15+2,tensors,1302,piedperson,1248,d4 d5 c4 Nf6 cxd5 Nxd5 Nc3 Nc6 Nf3 Bf5 e4 Nxc3 bxc3 Bxe4 Bb5 Qd5 O-O Qxb5 Bf4 Bd3 Re1 O-O-O Rb1,D06,Queen's Gambit Refused: Marshall Defense,4
gH21a6oq,True,1502750000000.0,1502750000000.0,32,resign,black,10+0,tensors,1314,shelob,1270,d4 d5 c4 dxc4 e3 Nf6 Bxc4 Nc6 Nf3 e6 O-O Bd6 Nc3 O-O e4 Bb4 Bg5 Bxc3 bxc3 h6 Bh4 g5 Bg3 Nxe4 Be5 Nxe5 dxe5 Qxd1 Rfxd1 Nxc3 Rdc1 Ne2+,D20,Queen's Gambit Accepted: Old Variation,5
giix8ieL,False,1502490000000.0,1502490000000.0,73,resign,white,15+2,grafy,1445,tensors,1314,d4 d5 c4 e6 Nc3 dxc4 e3 Nf6 Bxc4 Bb4 Bd2 O-O Nf3 Nc6 a3 Bxc3 Bxc3 Bd7 Ne5 Nxe5 dxe5 Ne4 Qd3 Nxc3 bxc3 Qg5 Qxd7 Qxg2 O-O-O Qxf2 Qxc7 Qxe3+ Rd2 Rad8 Rd1 Rxd2 Rxd2 Qe1+ Kc2 Qe4+ Kb2 f6 Bxe6+ Kh8 Rd8 Qe2+ Kb3 Qb5+ Kc2 Qe2+ Rd2 Qxe5 Qd8 Qxe6 Qxf8+ Qg8 Qxg8+ Kxg8 Rd8+ Kf7 Rd7+ Kg6 Rxb7 f5 Rxa7 f4 Kd2 Kg5 Ke2 Kg4 Rxg7+ Kf5 Kf3,D31,Queen's Gambit Declined: Queen's Knight Variation,5
Un8lFrlI,True,1502430000000.0,1502430000000.0,90,resign,black,15+15,tensors,1321,ivanchenko-andriy,1451,d4 d5 c4 e6 Nc3 Nf6 Bg5 h6 Bh4 Be7 Bxf6 Bxf6 Nf3 Nc6 e3 O-O Qb3 a6 Bd3 Na5 Qc2 b6 O-O Kh8 cxd5 Bb7 dxe6 Bxf3 gxf3 fxe6 Rfe1 Bh4 Be4 Qg5+ Kf1 c6 b4 Nc4 Bxc6 Rac8 Bb7 Rc7 Bxa6 Rxf3 Bxc4 Rxf2+ Qxf2 Bxf2 Kxf2 Rxc4 Rac1 Qh4+ Ke2 Qxh2+ Kd3 Rxb4 Re2 Qh5 a4 b5 axb5 Qf5+ Kd2 Rb2+ Rc2 Rb3 Re1 e5 Rb1 Qf2+ Kc1 Qe1+ Nd1 Rxe3 b6 Rd3 Kb2 Qb4+ Kc1 Rxd1+ Kxd1 Qxb1+ Kd2 Qb4+ Rc3 Qxd4+ Rd3 Qxb6 Rd8+ Qxd8+,D50,Queen's Gambit Declined: Modern Variation,7
xNeUwMhV,True,1502400000000.0,1502400000000.0,41,mate,white,15+15,yorashi,1300,tensors,1333,e4 c5 Nf3 d6 Bb5+ Bd7 Bxd7+ Nxd7 O-O Ngf6 d3 g6 c3 Bg7 d4 e5 Bg5 O-O Nbd2 h6 Be3 cxd4 cxd4 Qa5 Qc2 Rac8 Qb3 Rfe8 Rac1 Rxc1 Rxc1 b6 Rc7 exd4 Bxd4 Ne5 Bxe5 dxe5 Qxf7+ Kh7 Qxg7#,B52,Sicilian Defense: Canal Attack |  Main Line,6
ckyHRYkd,True,1502320000000.0,1502320000000.0,43,resign,white,15+2,tensors,1318,montex,1449,d4 d5 c4 Nf6 Nc3 Nc6 cxd5 Nxd5 Nf3 Nxc3 bxc3 e5 e4 exd4 cxd4 Bg4 Bb5 Qd6 d5 Qb4+ Bd2 Qxb5 dxc6 Qxc6 h3 Bxf3 Qxf3 O-O-O O-O Rxd2 Qxf7 Qxe4 Rad1 Rxd1 Rxd1 Bd6 Qxg7 Rf8 Rxd6 Qe1+ Kh2 Qe5+ Qxe5,D06,Queen's Gambit Refused: Marshall Defense,4
qRI4whmd,True,1502320000000.0,1502320000000.0,38,resign,black,15+2,sdw207,1450,tensors,1303,d4 Nf6 c4 g6 Nc3 Bg7 e4 d6 Nf3 O-O Be2 c5 d5 e6 O-O exd5 cxd5 Bg4 h3 Bxf3 Bxf3 Nbd7 Be2 Re8 Qc2 Qa5 Bd2 Ne5 Nb5 Qd8 Bc3 a6 Na3 b5 Bxe5 Rxe5 f3 h5,A73,Benoni Defense: Classical Variation |  Main Line,17
fE1B5wMl,True,1502300000000.0,1502300000000.0,41,mate,white,15+2,tensors,1290,egroka,1367,d4 d5 c4 dxc4 e3 Be6 Na3 b5 Nxb5 c6 Na3 Qa5+ Bd2 Qa6 Rc1 Bd5 Nxc4 Qxa2 Ra1 Qxc4 Bxc4 Bxc4 e4 Nf6 d5 cxd5 exd5 Bxd5 Bg5 Bxg2 Bxf6 gxf6 Rc1 Nc6 Qa4 Bxh1 Rxc6 e6 Rd6+ Ke7 Qd7#,D20,Queen's Gambit Accepted: Old Variation,5
pbX2HMso,True,1502250000000.0,1502250000000.0,84,resign,black,15+2,tensors,1300,facuuu,1330,d4 d5 c4 e6 Nc3 Nf6 cxd5 exd5 Bg5 Be7 Nf3 h6 Bh4 c6 e3 Bg4 Be2 Nh7 Bxe7 Qxe7 h3 Bf5 O-O Nd7 Bd3 Bxd3 Qxd3 O-O Rfe1 Ng5 Nxg5 Qxg5 e4 Qg6 Rad1 Rae8 e5 Qxd3 Rxd3 Re6 Rde3 Nb6 f4 f5 g4 fxg4 hxg4 Rxf4 Rg3 Rxd4 Rd1 Rxd1+ Nxd1 Rxe5 Ra3 Re1+ Kf2 Rxd1 Rxa7 Rd2+ Ke1 Rxb2 Rxb7 Nc4 Rxb2 Nxb2 a3 c5 Kd2 d4 Kc2 Na4 Kb3 Nb6 a4 c4+ Kb4 d3 a5 d2 a6 d1=Q Kb5 Qb3+,D35,Queen's Gambit Declined: Exchange Variation |  Positional Variation #2,9
TVcCQzD5,True,1502240000000.0,1502240000000.0,56,resign,black,15+2,czarek77,1209,tensors,1291,b3 e5 Bb2 Nc6 e3 Nf6 f3 d5 Bb5 Bd7 Bxc6 Bxc6 Bxe5 Bd6 Bxf6 Qxf6 c3 O-O d4 Rfe8 f4 Rxe3+ Kd2 Bxf4 Kc2 Rae8 Kb2 Qf5 Nd2 Re1 Qf3 Rxa1 Kxa1 g6 Kb2 Bxd2 Qxf5 gxf5 Nf3 Re2 g3 f4 g4 Bd7 h3 b6 Ne5 Be6 Nc6 f3 Kc2 Bh6+ Kd1 Rxa2 Nb4 Ra1+,A01,Nimzo-Larsen Attack: Modern Variation #4,5
KYsVM4yI,True,1502230000000.0,1502230000000.0,30,resign,black,15+2,tensors,1299,fischerfisch,1418,d4 d5 c4 c6 Nc3 e6 cxd5 exd5 Nf3 Bg4 e4 dxe4 Nxe4 f5 Nc3 Bb4 Bd2 Nf6 a3 Ba5 b4 Bb6 Be2 Bxf3 Bxf3 Bxd4 Bg5 Bxc3+ Bd2 Bxa1,D31,Semi-Slav Defense: Accelerated Move Order,6
e4kFuJQ9,False,1502130000000.0,1502130000000.0,6,resign,white,40+20,nf1951,1814,tensors,1299,e4 e5 Nf3 Nc6 Bc4 Na5,C50,Italian Game,5
5FPLsNja,True,1502080000000.0,1502080000000.0,67,resign,white,15+2,spetsnaz_gm,1348,tensors,1308,e4 e5 Qh5 Nc6 c3 Nf6 Qd1 Bc5 f3 O-O Nh3 d5 d4 Be6 Bg5 Be7 Bb5 dxe4 d5 Qxd5 Bxf6 Qxd1+ Kxd1 Bxf6 Bxc6 bxc6 fxe4 Rad8+ Kc2 Rd7 Nd2 Rfd8 Rad1 Bg4 Nf3 Bxh3 gxh3 Rxd1 Rxd1 Rxd1 Kxd1 h5 h4 Be7 b4 f6 Kd2 g5 hxg5 fxg5 Nxe5 Kg7 Nxc6 Kf6 Nxa7 Ke5 Kd3 g4 Nc6+ Kd6 b5 h4 Nd4 g3 hxg3 hxg3 Nf5+,C20,King's Pawn Game: Wayward Queen Attack,3
uBwEbVAF,True,1502040000000.0,1502040000000.0,56,resign,black,15+2,tensors,1318,thinkingmanga63,1366,d4 d5 c4 dxc4 e3 Nf6 Bxc4 Bf5 Nf3 Bxb1 Rxb1 e6 e4 Nxe4 O-O Bd6 d5 Nc5 dxe6 Nxe6 Be3 a6 Re1 O-O Nd4 Qh4 h3 Re8 Nxe6 Qxc4 Ng5 Nc6 Rc1 Qxa2 Bc5 Red8 Qd3 Bxc5 Qxh7+ Kf8 Rxc5 Ne7 Rxc7 Qxb2 Rcxe7 g6 Nxf7 Re8 Rxe8+ Rxe8 Qh8+ Qxh8 Nxh8 Rxe1+ Kh2 Kg7,D20,Queen's Gambit Accepted: Old Variation,5
7sZ6ADlB,True,1502000000000.0,1502000000000.0,103,resign,white,15+2,ineedaname,1324,tensors,1329,e4 e5 Nf3 Nc6 c3 Nf6 d3 Bc5 Nbd2 d5 Be2 O-O O-O b6 Nb3 Be6 Nxc5 bxc5 exd5 Bxd5 Be3 e4 dxe4 Nxe4 Bd3 c4 Bxe4 Bxe4 Bc5 Qxd1 Raxd1 Rfe8 Nd4 Nxd4 Bxd4 g6 Rfe1 a6 f3 Bc2 Rc1 Ba4 Kf2 Rxe1 Rxe1 Kf8 Re3 Re8 Rxe8+ Kxe8 Ke3 Ke7 Bg7 Ke6 Kd4 Bb5 Kc5 c6 Kb4 f5 b3 cxb3 axb3 Bf1 g3 g5 Kc5 Bg2 f4 gxf4 gxf4 h5 h4 Kf7 Be5 Ke6 Kb6 Bd5 b4 Be4 Kxa6 Kd5 Kb6 Kc4 Kc7 Kb5 Kd6 Kc4 Ke6 c5 bxc5 Kxc5 Kf6 Kc4 Kg5 Kd3 Kxh5 Ke3 Kg6 Kf3 h5 Kg3 h6,C44,Ponziani Opening: Jaenisch Counterattack,6
1iCdDMNl,True,1501960000000.0,1501960000000.0,40,mate,black,15+2,tensors,1345,fran_1991,1187,d4 d5 c4 dxc4 e3 f6 Bxc4 Nc6 Nf3 e5 O-O Bg4 dxe5 Nxe5 Qxd8+ Rxd8 Nxe5 fxe5 f3 Bh5 Nc3 Nf6 f4 exf4 exf4 Bc5+ Kh1 c6 Re1+ Be7 b3 b5 Be2 O-O Bxh5 Nxh5 Rxe7 b4 Ne4 Rd1#,D20,Queen's Gambit Accepted: Old Variation,5
8lPSOnVV,True,1501920000000.0,1501920000000.0,52,resign,black,15+2,tensors,1352,gambeet21,1149,d4 d5 c4 e6 Nc3 Bb4 Bd2 dxc4 e3 Bxc3 Bxc3 Qd5 Qa4+ b5 Qb4 Nc6 Qc5 a5 Qxd5 exd5 a3 Nge7 Nf3 Ba6 Be2 b4 axb4 axb4 Bd2 b3 O-O O-O Ne5 Nxe5 dxe5 g6 Bf3 c3 Bxc3 Bxf1 Rxa8 Rxa8 Kxf1 Ra1+ Ke2 c6 e4 dxe4 Bxe4 Ra4 f4 Rxe4+,D31,Queen's Gambit Declined: Queen's Knight Variation,5
YQvHXNdq,True,1501870000000.0,1501870000000.0,57,draw,draw,15+2,tensors,1350,djjohnson,1429,d4 Nf6 c4 e6 Nc3 d5 cxd5 exd5 Bg5 c6 Nf3 Bd6 e3 O-O Bd3 Nbd7 O-O h6 Bh4 Qc7 h3 Re8 Qc2 Ne4 Bxe4 dxe4 Nd2 Nf6 Bxf6 gxf6 f3 Bf5 fxe4 Bg6 Rxf6 Qe7 Raf1 Kg7 R6f2 Bg3 Rf3 Bh4 g3 Bg5 h4 Bxh4 gxh4 Qxh4 Qb3 Qg4+ Kh2 Qh4+ Kg1 Qg4+ Kh2 Qh4+ Kg1,D35,Queen's Gambit Declined: Exchange Variation |  Positional Variation,10
BHUzGb7V,True,1501820000000.0,1501820000000.0,23,resign,white,15+2,pearicetea,1403,tensors,1340,e3 e5 d4 Nc6 dxe5 Nxe5 Nf3 Bd6 Nxe5 Bxe5 Qf3 Qf6 Qd5 Ne7 Qd1 O-O h4 Bxb2 Bxb2 Qxb2 Nd2 Qb3 Nxb3,A40,Englund Gambit Declined |  Reversed French,3
W3fUpxff,True,1501570000000.0,1501570000000.0,39,mate,white,15+2,tensors,1322,firstthebest,1072,d4 d5 c4 dxc4 e3 Nc6 Bxc4 e5 Nf3 e4 Nfd2 Nxd4 exd4 Qxd4 O-O Nf6 a4 e3 fxe3 Qxe3+ Rf2 Ng4 Qe2 Qxe2 Rxe2+ Be7 h4 Ne3 Rxe3 Kf8 b3 Bh3 gxh3 Ba3 Bxa3+ Kg8 Rf3 c6 Bxf7#,D20,Queen's Gambit Accepted: Old Variation,5
eCQSU6WF,True,1501530000000.0,1501530000000.0,52,resign,black,15+2,tensors,1331,olesam,1382,d4 d5 c4 e5 dxe5 d4 e3 Bb4+ Nd2 d3 Qa4+ Nc6 g3 Be6 Bg2 Ne7 e4 Bxc4 a3 Bxd2+ Bxd2 Qd4 Nf3 Qxb2 O-O Bb3 Rfb1 Qxb1+ Rxb1 Bxa4 Rxb7 O-O Rxc7 Rab8 Rxa7 Bc2 h3 Rb1+ Bf1 h6 Ne1 Rb2 Bxd3 Bxd3 Nxd3 Rxd2 Nb4 Nxb4 axb4 Nc6 Ra4 Rb8,D08,Queen's Gambit Refused: Albin Countergambit,4
sOofcpg2,True,1501530000000.0,1501530000000.0,41,resign,white,15+2,olesam,1373,tensors,1341,d4 d5 c4 e6 Nf3 dxc4 e3 b5 a4 c6 Nc3 Nf6 axb5 cxb5 Nxb5 Ba6 Bxc4 Bxb5 Bxb5+ Nfd7 Ne5 Qa5+ Bd2 Qxb5 Qf3 Nxe5 dxe5 Qxb2 O-O Qxd2 Qxa8 Qb2 Rxa7 Bc5 Rb7 Qxe5 Rxb8+ Kd7 Qb7+ Kd6 Rd1+,D21,Queen's Gambit Accepted: Rosenthal Variation,6
stoudusq,True,1501120000000.0,1501120000000.0,33,resign,white,15+15,anotherchessplayer1,1350,baygonv,1265,e4 e5 Nf3 Nc6 d4 d6 Bb5 Bd7 Nc3 exd4 Nxd4 Nxd4 Bxd7+ Qxd7 Qxd4 c6 Be3 Nf6 O-O-O O-O-O f3 c5 Qd2 g6 Nd5 Bg7 Qa5 Nxd5 Rxd5 a6 Rhd1 Qc6 Bf4,C44,Scotch Game,5
Q8AA3Qby,True,1501120000000.0,1501120000000.0,58,resign,black,15+15,aig7,1270,anotherchessplayer1,1299,d4 d5 Nc3 e6 Nf3 c5 e3 Nc6 Ne5 cxd4 exd4 Bd6 Bb5 Qc7 O-O Bxe5 dxe5 Qxe5 Re1 Qc7 Qg4 g6 Nxd5 Qa5 Nc3 Ne7 Qd4 O-O Qf6 Nd5 Qf3 Nd4 Qd3 Nxc3 bxc3 Nxb5 c4 Qxe1+ Qf1 Qxf1+ Kxf1 Nd4 a4 Nxc2 Ra2 Nb4 Rb2 Nc6 f4 Rd8 g3 Rd1+ Ke2 Rxc1 Rd2 Rxc4 Rd8+ Nxd8,D00,Queen's Pawn Game: Chigorin Variation,3
R9lE5mr6,True,1501120000000.0,1501120000000.0,31,mate,white,15+15,anotherchessplayer1,1223,aig7,1282,e4 d5 exd5 Qxd5 Nc3 Qc6 Nf3 Nf6 Bb5 Qxb5 Nxb5 e6 Nxc7+ Kd8 Nxa8 Bd7 Ne5 Bd6 Nxf7+ Kc8 Nxh8 g6 Nf7 Bf4 d3 Bxc1 Qxc1 Ng4 Qf4 h5 Qc7#,B01,Scandinavian Defense: Mieses-Kotroc Variation,4
KKoEd9W4,True,1501120000000.0,1501120000000.0,15,resign,white,15+15,eltiago,1289,anotherchessplayer1,1306,e4 e5 Nf3 Nc6 Nc3 Nf6 Bc4 Bc5 Ng5 O-O O-O h6 Nf3 d5 Bxd5,C50,Four Knights Game: Italian Variation,8
AFBQ040C,True,1501120000000.0,1501120000000.0,32,resign,black,15+15,blinskey,1007,anotherchessplayer1,1268,e4 e5 Nf3 Nc6 Bc4 Be7 c3 Nf6 Qe2 O-O d4 d6 Be3 exd4 cxd4 Nxe4 O-O Bg4 Nc3 Nf6 Rfe1 d5 Bd3 Bb4 a3 Ba5 b4 Bb6 Bf4 Nxd4 Bg5 Nxe2+,C50,Italian Game: Hungarian Defense,6
jRosMYvP,True,1504120000000.0,1504130000000.0,45,resign,white,10+0,bassim,1170,hill_j,1179,e4 e5 d4 exd4 Qxd4 c6 h4 d5 e5 f6 Nf3 Bg4 Ng1 Be6 Na3 Qa5+ c3 Bxa3 exf6 Nxf6 b4 Qa6 Bxa6 Nxa6 Bf4 O-O Bd6 Rfd8 Be7 Rd7 Bxf6 Rf7 Be5 Re8 Nf3 Bb2 Rb1 Ba3 Ng5 Rfe7 Kd2 h6 Nf3 Rc7 Bxc7,C21,Center Game,5
47I7Smmy,True,1504120000000.0,1504120000000.0,25,resign,white,10+0,stonedragon,1442,hill_j,1183,e4 e5 Nf3 Nc6 Bb5 a6 Ba4 b5 Bb3 Nf6 d3 Bb4+ Bd2 d6 Bxb4 Nxb4 Ng5 d5 exd5 Nfxd5 Bxd5 Qxg5 Bxa8 Qxg2 Bxg2,C70,Ruy Lopez: Morphy Defense |  Caro Variation,8
mjeeolDf,True,1503950000000.0,1503950000000.0,15,resign,white,15+15,hill_j,1172,piotrpiotr,1170,e4 e5 Nf3 Nf6 Nc3 d5 d3 d4 Nb1 Be6 Nxe5 Qd5 Nf3 Nc6 exd5,C42,Russian Game: Three Knights Game,5
bn6tE2Gy,True,1503930000000.0,1503930000000.0,62,resign,black,15+15,hill_j,1178,armo96,1346,e4 c6 d4 d5 Nc3 dxe4 Nxe4 Bf5 Bd3 Nd7 Nc3 Bxd3 Qxd3 e6 Nf3 Ngf6 Bg5 h6 Bh4 Be7 Bg3 a5 O-O a4 Ne5 O-O a3 c5 Rad1 Nb6 Qb5 cxd4 Nxa4 Nxa4 Qxb7 Nc5 Qf3 Na4 Nc6 Qd7 Rxd4 Nd5 Ne5 Qb5 Rfd1 Nxb2 Rb1 Bc5 Rh4 Rxa3 Qg4 Nc3 Re1 Nbd1 Qxg7+ Kxg7 Rg4+ Kh7 Rh4 Ne2+ Kf1 Nxg3+,B18,Caro-Kann Defense: Classical Variation,8
SQz0aocr,True,1503890000000.0,1503890000000.0,59,resign,white,15+15,beef_cake,1171,hill_j,1190,e4 e5 Nf3 Nc6 Bc4 Bc5 c3 Nf6 d4 d6 dxc5 d5 exd5 Ne7 Nxe5 Nexd5 Bxd5 Nxd5 c4 Nb6 Qxd8+ Kxd8 cxb6 axb6 Nxf7+ Ke7 Nxh8 Be6 O-O Rxh8 Re1 Kd7 Nc3 Bxc4 Re4 Bd3 Re3 Bg6 Bd2 c5 Rae1 c4 Re7+ Kc6 Rxg7 b5 Ree7 b4 Rc7+ Kd6 Nb5+ Kd5 Bxb4 Be8 Bc3 Bxb5 Rg5+ Kd6 Be5+,C53,Italian Game: Classical Variation |  Center Attack,9
9bpYNzjf,True,1503880000000.0,1503880000000.0,51,resign,white,15+15,hill_j,1175,justin2718,1329,e4 e5 Nf3 Nc6 Bb5 a6 Ba4 Bc5 O-O Nf6 Nc3 O-O d3 b5 Bb3 b4 Nd5 Nxd5 exd5 Nd4 Nxe5 Nxb3 axb3 Bb7 c4 bxc3 bxc3 Bxd5 d4 Ba7 Ra5 Bb7 Bf4 c5 Qh5 Qxa5 Nxd7 Rfd8 Ne5 cxd4 Qxf7+ Kh8 Qxb7 Bb8 Nf7+ Kg8 Nxd8 Qxd8 Qxa8 d3 Qxb8,C78,Ruy Lopez: Morphy Defense |  Neo-Arkhangelsk Variation,10
faXIXTIb,True,1503880000000.0,1503880000000.0,22,resign,black,15+15,plahbrogan,1273,hill_j,1160,d4 d5 f4 Bf5 e3 Nc6 g4 Be4 c4 Bxh1 cxd5 Bxd5 Nc3 Nf6 g5 Ne4 Nxd5 Qxd5 Qf3 Qa5+ Bd2 Nxd2,D00,Queen's Pawn Game,2
BvcCXIJt,True,1503870000000.0,1503870000000.0,27,resign,white,10+0,hill_j,1154,arwiz,974,e4 e5 Nf3 d6 d4 d5 Bd3 exd4 Nxd4 Nf6 e5 Ng4 Nc3 Qe7 Bf4 Nc6 Nxd5 Qd7 Bc4 Nxd4 Qxd4 b6 Bb5 Qxb5 Nxc7+ Ke7 Nxb5,C41,Philidor Defense,5
FH8TvLSY,True,1503860000000.0,1503870000000.0,34,resign,black,15+15,hill_j,1167,vwhite,1122,e4 e5 Nf3 Nc6 Bb5 Nf6 d4 Nxe4 dxe5 Bb4+ c3 Bc5 Qd5 Nxf2 Rf1 b6 Bxc6 dxc6 Qxc6+ Bd7 Qd5 Ng4 Bf4 Bb5 Qxd8+ Rxd8 Rh1 Nf2 Rf1 Nd3+ Kd2 Nxf4+ Kc2 Bxf1,C65,Ruy Lopez: Berlin Defense #2,6
99ONvKAR,True,1503840000000.0,1503840000000.0,79,outoftime,white,10+0,virgil777,1439,hill_j,1171,e4 e5 Nf3 Nc6 Bb5 a6 Ba4 b5 Bb3 Bc5 O-O Nf6 d3 O-O c3 d5 Bg5 Bg4 exd5 Ne7 Bxf6 gxf6 c4 Qd7 Nbd2 Qf5 Bc2 Bd4 Rb1 Ng6 Qe1 Bxf3 Nxf3 Rae8 Qe4 Qxe4 dxe4 Nf4 Nxd4 exd4 b3 Ne2+ Kh1 f5 exf5 Nc3 Rb2 Re2 g3 Rfe8 a4 Re1 Kg2 R8e2 Rxe1 Rxe1 Bd3 Nd1 Ra2 Nc3 Ra3 f6 axb5 Nb1 Rxa6 Nc3 Ra7 c6 Rc7 Rd1 bxc6 Rb1 Rc8+ Kg7 Rb8 Rd1 Bc2 Ne4 Bxe4,C70,Ruy Lopez: Morphy Defense |  Graz Variation,10
ukTTpK9V,True,1503840000000.0,1503840000000.0,73,resign,white,15+15,gabofd,1245,hill_j,1170,e4 e5 Nf3 Nc6 Bc4 Bc5 c3 Nf6 d3 O-O O-O d6 Bb3 Bg4 h3 Bh5 Nbd2 d5 Re1 d4 Nf1 Qd7 Ng3 Rae8 Ng5 Bxd1 Rxd1 Be7 Nf5 Nxe4 dxe4 Bxg5 Bxg5 Na5 Bc2 Qe6 cxd4 exd4 Nxd4 Qg6 Bf4 Nc4 e5 Qb6 b3 Nxe5 Nf5 Re6 Be3 Qc6 Nd4 Qxc2 Nxc2 Rfe8 Nd4 Rg6 Nb5 Nf3+ Kf1 Nh2+ Kg1 Nf3+ Kf1 Nh4 g3 Nf5 Nxc7 Nxe3+ fxe3 Rf6+ Kg2 Rxe3 Rd8+,C53,Italian Game: Classical Variation |  Giuoco Pianissimo,9
XwMJo8Hb,True,1503530000000.0,1503530000000.0,74,mate,black,10+0,minigunexplosive,1250,hill_j,1156,g3 e5 Bg2 d5 b3 Nc6 Bb2 Nf6 Nc3 Be6 Nf3 Bd6 O-O O-O Nb5 e4 Ne1 a6 Nxd6 Qxd6 e3 d4 c3 d3 c4 b5 Bxf6 gxf6 Rc1 Rad8 Bxe4 f5 Bxd3 Ne5 Be2 c5 Nd3 Nxd3 Rc3 Nb2 Qc2 Qxd2 Qxd2 Rxd2 Bf3 Rc8 Re1 Rcd8 Re2 Rd1+ Kg2 R8d2 Rxd2 Rxd2 cxb5 Nd1 Bxd1 Rxd1 b6 Rd6 Rxc5 Rxb6 Rc3 Bd5+ Kg1 h5 h4 Rd6 a4 Bf3 b4 Rd1+ Kh2 Rh1#,A00,Hungarian Opening,1
Wxgi9dv0,True,1503530000000.0,1503530000000.0,92,resign,black,10+0,hill_j,1164,martan1208,1263,e4 e5 Nf3 Nc6 Bb5 a6 Ba4 b5 Bb3 Nf6 Nc3 h6 d3 Bb4 O-O Bxc3 bxc3 d5 d4 dxe4 dxe5 Qxd1 Rxd1 Bg4 exf6 gxf6 Bd5 O-O-O Rd2 Ne7 Bxe4 f5 Bb7+ Kxb7 Ne5 Bd1 Nxf7 Rxd2 Bxd2 Rf8 Ne5 Bh5 Nd7 Rd8 Nc5+ Kb6 Be3 Nd5 c4 Nxe3 fxe3 Kxc5 Rb1 Kxc4 Rb3 Rd1+ Kf2 Rd2+ Ke1 Rxc2 Rb1 Rxa2 Rc1+ Kb3 Rxc7 Rxg2 Rf7 Bg4 Rg7 Kc3 e4 fxe4 Rc7+ Kb4 Rg7 Bf3 Rxg2 Bxg2 Kf2 Bh3 Ke3 a5 Kxe4 a4 Kd3 Kb3 Kd2 Kb2 Kd3 a3 Kd2 a2,C70,Ruy Lopez: Morphy Defense |  Caro Variation,8
zijw7opz,True,1503530000000.0,1503530000000.0,26,resign,black,15+15,hill_j,1173,smashtoblack,1251,e4 c5 Nf3 Nc6 Bb5 Nf6 d3 Nd4 Be3 Nxb5 Nc3 Nxc3 bxc3 e6 d4 cxd4 cxd4 Nxe4 Qd3 d5 Qb5+ Bd7 Qxb7 Qc8 Qa6 Qxa6,B30,Sicilian Defense: Nyezhmetdinov-Rossolimo Attack,5
5XspUzEQ,True,1503530000000.0,1503530000000.0,40,mate,black,15+15,tomplfr,1089,hill_j,1165,e4 e5 Nf3 Nc6 Bc4 Bc5 O-O Nf6 d3 d5 Bxd5 Nxd5 exd5 Qxd5 Nc3 Qe6 Ng5 Qg6 Nce4 Be6 Nxc5 h6 Ncxe6 fxe6 Nf3 O-O-O Re1 Rd5 c4 Rc5 Qa4 Qf6 Nd2 Rf8 Ne4 Qf5 Nxc5 Qxf2+ Kh1 Qxe1#,C50,Giuoco Piano,6
mF8Y8wMD,True,1503440000000.0,1503440000000.0,77,resign,white,10+0,plengkung,1278,hill_j,1173,e4 e5 c3 Nc6 d4 d5 f3 Nf6 dxe5 Nxe5 g4 h6 Bf4 Bd6 exd5 Nd3+ Bxd3 Bxf4 Qa4+ c6 Qxf4 Nxd5 Qe4+ Be6 c4 Qh4+ Ke2 Nf6 Na3 Nxe4 Bxe4 f5 gxf5 Bd7 c5 b6 cxb6 axb6 Nc4 b5 Nb6 Rd8 Ke3 Qf6 Rd1 Bxf5 Bxc6+ Qxc6 Rxd8+ Kxd8 Kf4 Qxb6 Ne2 Bd7 Rd1 Rf8+ Kg3 Qg6+ Kf2 Rf5 Nd4 Qb6 b4 Bc6 Kg3 Rg5+ Kf2 Qb8 Nxc6+ Kc7 Nxb8 Kxb8 Rd8+ Kb7 f4 Rd5 Rxd5,C20,King's Pawn Game: Macleod Attack,3
